Sentence #,Standard_Bangla,Chittagong,Sylhet,Noakhali,Mymensingh,Barishal
1,কেমন আছো,কেন আচো?,ভালা আছনি?,কেইক্কান আছেন ?,কেমত আছো?,আসো কোরোহম?
2,আজকে আমার মন ভালো নেই,আযিয়া আর মন বালা নাই?,আইজকু আমার মন ভালা নায়,আইজ্জা আর মন ভালা নাই,আইজ আমার মন ভালা নাই,আইজ মোর মনডা ভালোনা
3,তুমি কি করো,তুঁই কি গরো?,তুমি কিতা খরো?,তুমি কিআ করর ?,তুমি কিতা করো?,ও মোনু হর কি?
4,এই গরমে আমার কিছু ভালো লাগে না,এই গরমত আত্তুন কিচু বালা ন লাগের,অউ গরমো আমার কুনতা ভালা লাগের না,এতো গরমে আর কিচ্ছু ভালা লাগে না,এই গরমডাত আমার কিছু ভালা লাগে না,এই থাডা পরা গরমে মোর কিস্সু ভাল্লাগেনা
5,ছেলেটি সাদা রঙয়ের একটি শার্ট পরে এসেছিল,ফোয়াইবা সাদা রংওর উজ্ঞা শার্ট ফরি আইস্যিল,ফুয়াটায় এখটা সাদা রংগর শার্ট পিন্দিয়া আইছিল,পোলাডা একটা সাদা রং এর শার্ট পড়ি আইসিলো,ছেড়াটা সাদা রংগের একটা শার্ট পইড়া আইছিল,পলাউগ্গা এউক্কা ধলা রং এর এউক্কা গুন্জি পইর্রা আইসেল
6,মেয়েটি লাল রঙয়ের শাড়ি পরে আমার সাথে দেখা করতে এসেছিল,মাইফোয়াইবা লাল রংওর শারি ফরি আঁর লই দেহা গইর্ তো আইস্যে,ফুড়িটায় লাল রংগর শাড়ি পিন্দিয়া মোর লগে দেখা করাত আইছিল,মাইয়াডা লাল রং এর শাড়ি পরি আমার লগে দেখা করতে আইসিলো,ছেড়িটা লাল রংগের শাড়ি পইরা আমার সাথে দেখা করতে আইসিল,মাইআউগ্গা লাল  রুঙ্গা  শাড়ি পইর্রা মর লগে দেহা হর্তে আইসিলো
7,ছেলেটি সিলেট থেকে ঢাকায় এসেছে,ফোয়াইবা সিলেটত্তুন ঢাহা আইস্যে,ফুয়াটায় সিলেট থাকি ঢাকাত আইছে,পোলাডা সিলেট থেইকা ঢাকায় আইসে,ছেড়াটা সিলেটতন ঢাকাত আইসে,পলাউগ্গা শ্যলেত দিয়া ধাহা আইসেলে
8,মেয়েটি সিলেট থেকে আসা এই ছেলেটিকে অনেক ভালবাসে,মাইফোয়া ইবা সিলেটত্তুন আইস্যেদে ফোয়া ইবারে বঊত বালবাসে,ফুড়িটায় সিলেট থাকি আওয়া অউ ফুয়াটারে অনেক ভালা পায়,মাইয়াডা সিলেট থেইকা আশা পোলাডারে অনেক ভালোবাসে,ছেড়িটা সিলেট থাইকা আসা অই ছেড়াটারে অনেক ভালবাসে,মাইআউগ্গা শ্যলেত দিআ আঔআ পলাউগ্গারে আক্সের ভালপায়
9,ছেলেটি মেয়েটাকে এখনো ভালবাসার চোখে দেখেনি,ফোয়াইবা মাইফোয়া ইবারে আইযো বালবাসার চোকে ন দেহে,ফুয়াটায় এবো ধরি ফুড়িটারে ভালা পাওয়ার চউকে দেখছে না,পোলাডা মাইয়াডারে এখনো ভালোবাসার চোখে দেখেনো,ছেড়াটা ছেড়িটারে এখনো ভালবাসার চোখে দেখে নাই,পলাউগ্গা মাইআউগ্গারে আহন ভালপাঔআর ছহে দেহেনাই
10,মেয়েটি তাঁর সব স্বপ্নের মধ্যে ছেলেটাকে কল্পনা করে,মাইফোয়া ইবা তার বেজ্ঞিন সফ্নর মইদ্দে ফোয়াইবারে কল্ফনা গরে,ফুড়িটাায় তাইর হখল সফনর মাজে ফুয়াটারে কল্পনা করে,মাইয়াদা  হিগার  স্বপ্নের ভিতরে খালি পোলাগারে লই চিন্তা করতে থাকে,ছেড়িটা তার সপ্নের মধ্যে ছেড়াটারে কল্পনা করে,মাইআউগ্গা হেয়ার শব হপ্পনের মইদ্ধে পলাউগ্গারে ভাব্তে থাহে
11,আমার অনেক দিন আগে একবার বিয়ে হয়েছিল,আঁর বউতদিন আগে এব্বার বিয়া অইল,আমার বাক্কা আগে এখবার বিয়া অইছিল,আর অনেকদিন আগে একবার বিয়া অইছিলো,আমার অনেকদিন আগে একবার বিয়া হইছিল,মর বহুত দিন আগের্গ এউক্কা বিয়া হইসেলে
12,আমার মা আমাকে বলেছিল বিয়ে হলে জীবন পরিবর্তন হয়ে যায়,আঁর মা আঁরে হইল বিয়া অইলে জিবন ফাল্টি যা গই,আমার আম্মায় আমারে কইছলা বিয়া অইলে জীবন বদলি যায়,আর মা অরে কৈসিলো বিয়া হইলে জীবন পরিবর্তন হয়ে  যায়,আমার মা আমারে কইসিল বিয়া হইলে জীবন বদলায়া যায়,মর মাএ মরে কইসেলে বিআ হর্লে জিবন পরিবর্তন হইআ জায়
13,আম্মু ঐদিন ঠিক কথাই বলেছিলও,আম্মু অইদিন টিক হতাই হইল,আম্মায় হেদিন ঠিক কথাউ কইছলা,মা যেদিন ঠিক কথা যে কৈসিলো,আম্মা অইদিন ঠিক কথাই কইসিল,মাএ অইদিন হাস্সইঅ কথাই কইসেলে
14,আম্মু সব সময় আমার মনের কথা বুঝে,আম্মু এগাযা আঁর মনোর হতা বুজে,আম্মায় হখল সময় অউ আমার মনর কথা বুজইন,আম্মা   বেক সময় আর মনের কথা বুঝে,আম্মা সব সময় আমার মনের কথা বুঝে,মাএ শব্কালে মর কইল্যার কথাউগ্গা বঝে
15,আমার বাসার কাজের মেয়েটি এখন ভাল মত কাজ করে নাহ,আঁর বাসার হাজর মাইফোয়া ইবা ইয়া গম গরি হাজ গরিত ন ফারে,আমার বাসার কামর ফুড়িটায় এখন ভালা মত কাম করে না,আনগো বাসার কামের মাইয়া ইগা ওন আর ভালা  কাম করে না,আমার ঘরের কামের ছেড়িটা এখন ভাল মত কাম করে নাহ,ঘরের কামের সেম্রি আহন থিক্কইর্রা কাম হরে না
16,আমার বাসার কাজের মেয়েটি দুইদিন ধরে পলাতক,আঁর বাসার হাজর মাইফোয়া ইবা দুইদিন অর দাই গিয়্যুয়,আমার বাসাার কামর ফুড়িটায় দুইদিন ধরি ভাগন্তিত,আনগো বাসার কামের মাইয়া ইগা দুইদিন ধরি পলাইরৈসে,আমার ঘরের কামের ছেড়িটা দুইদিন ধইরা পালাইছে,মর ঘরের কামের সেম্রি দুই দিন ধইর্রা পলাইন্না
17,আমার বাসার দারওয়ান এখন তাঁর গ্রামে ঘুরতে গিয়েছে,আঁর বাসার দারোয়ান এহন ইতার গেরামত বেরাইত গেয়্যে,আমার বাসার দারোয়ান এখন তার গ্রামো পাখানিত গেছে,আনগো বাড়ির দারোয়ান হেতের গ্রামের বাড়ি গেচে গুরবার লাই,আমার বাড়ির দারওয়ান এহন অর গ্রামে ঘুরতে গেছে,মর ঘরের দারআন আহন অই সেম্রির গেরামে ঘর্তে গেসে
18,তোমাকে আমি কল দিবো না,তোঁয়ারে আঁই কল ন দিয়ুম,আমি তুমারে কল দিতাম নায়,আন্নেরে আই কল দিমু না,তোমারে আমি কল দিতাম না,তমারে মুই কল্ দিমুনা
19,এই জিনিষটা খুবই বিরক্তিকর ছিল,এই জিনিসসান কুব বিরক্তিকর আচিল,অউ জিনিসটা খুবঅই  বিরক্তিকর আছিল,ইয়ান বেশি অসইজ্যো আসিল,এই জিনিসটা অনেক বিরক্তিকর আছিল,এই জিনিশ খান আক্কালে অনেক গা জলুইন্না আসেল
20,সে সিলেট থেকে আমার সাথে দেখা করতে এসেছিল,ইতে সিলেটত্তুন আঁর ফোয়ারে দেহা গইরতো আইস্যে,হে সিলেট থাকি আমার লগে দেখা করাত আইছিল,হেয় শীলোট তুন আর লগে দেয়া কইত্তে আইছিল,সে সিলেট থাইকা আমার সাথে দেখা করতে আইসিল,হে শ্যলেত দিআ মর লগে দেহা কর্তে আইসেলে
21,সে এখন রাজশাহী চলে গেছে,ইতে এহন রাজশাহী গেইয়্যুই,হে এখন রাজশাহীত গেছে গিয়া,হেয় অন রাসসায়ী চলি গেছে,সে এহন রাজশাহী চইলা গেসে,হে আহন রাজ্শাহি গেসিগ্গা
22,সে এখন তাঁর বন্ধুদের সাথে সিগারেট খায়,ইতে এহন তার বন্দুওক্কলর ফোয়ারে সিগেট হায়,হে এখন তার বন্ধুবান্ধবর লগে সিগারেট খায়,হেতে অন হেতের দোস্তের লগে বিড়ি টানে,সে এহন তার বন্ধুরার সাথে সিগারেট খায়,উনি আহন হেয়ার দস্গ গ লগে বিরি খায়
23,সে একদমই হাসে না,এতে এব্বেরেও ন আসে,হে এখেবারেউ হাসে না,হেতে এক্কারেই আশেনা,সে এক্কেরেই হাসেনা,হে আক্কালেই ভেত্কায় না
24,সে আমাকে অপমান করে,এতে আঁরে অফমান গইরগে,হে আমারে অপমান করে,হিগা আরে বেইজ্জুদি করে,সে আমারে অপমান করে,হে মরে আক্সের অপমান হিরে
25,তাঁর বই পরতে একদমই ভাল লাগে না,ইতাত্তুন বই ফইরতো এফফোডাও গম ন লাগে,তার বই পড়তে একদম অউ ভালা লাগে না,হিগার বই হইটটে এককারে বালা লাগে না,তার বই পড়তে এক্কেরেই ভালালাগেনা,হ্যার বই পড়তে এক্কালেই ভালো লাগে না
26,আপনার কি বই পড়ার অভ্যাস আছে,অনর কি বই ফরার অব্বাস আচে নে,আফনার কিতা বই পড়ার অভ্যাস আছে নি?,আন্নের কি বই হড়ার ঐববাস আছে?,আফনের কি বই পড়ার অভ্যাস আসে?,আমনের কি বই পড়ার অভ্যাস আছে?
27,তুমি কি আমাকে চিনো,তুঁই কি আঁরে চিনো নে,তুমি আমারে চিনো নি?,তুই য়ারে চিনো?,তুমি কি আমারে চিনো?,তুমি কি মোরে চেনো?
28,আমি তোমাকে চিনতে পারলাম না,আঁই তোয়াঁরে চিনিত ন ফাইরলাম,মুই তুুমারে চিনতাম পারিয়ার না,আই তোরে আগে কোনোসুমে দেই ন,আমি তোমারে চিনতে পারলাম না,মুই তোমারে চেনতে পারলাম না
29,আমি তোমাকে আগে কখনো দেখি নাই,আঁই তোয়াঁরে আগে হনো অত্তে ন দেহি,মুই তুমারে এর আগে কুনোদিন দেখছি না,আই  তোরে চিনতে হাইরলাম না,আমি তোমারে আগে কখনো দেখি নাই,মুই তোমারে আগে কহনো দেহি নাই
30,আমার পড়ালেখা করতে একদমই ভাল লাগে না,আঁত্তুন ফরালেহা গইরতো এফফোডাও গম ন লাগে,পড়ালেখা করতে আমার এখদম ভালা লাগে না,আর হরালেয়া কইত্তে একছের ভালা লাগে না,আমার পড়ালেহা করতে এক্কেরেই ভালালাগেনা,মোর পড়াল্যাহা করতে এক্কালেই ভালো লাগে না
31,আপনার পড়ালেখা করা উচিত,অনর ফরালেহা গরা উচিত,আফনার পড়ালেখা করা উচিত,আন্নের হরালেয়া করন দরকার,আপনের পড়ালেহা করা দরকার,আমনের পড়াল্যাহা করা দরকার
32,আপনাকে পড়ালেখা করতে হবে,অনোত্তুন ফরালেহা গরা ফরিবো,আফনার পড়ালেখা খরা লাগবো,আন্নেরে হরালেয়া কইত্তে অইবো,আপনের পড়ালেহা করতে হইব,আমনের পড়াল্যাহা করতে হইবে
33,আপনার কি কি পড়ালেখা করতে একদমই ভাল লাগে নাহ,অনর কি ফরালেহা গইরতো এব্বেরেও গম ন লাগে,আফনার কিতা পড়ালেখা করতে এখদম ভালা লাগে নানি?,আন্নের কি হরালেয়া কইত্তে একছের ভালা লাগে না,আপনের কি পড়ালেহা করতে এক্কেরেই ভালালাগে নাহ?,আমনের কি পড়াল্যাহা করতে এক্কালেই ভালো লাগে না?
34,তোর পড়ালেখা কোরতে হবে,তোত্তুন ফরালেহা গরা ফরিবো,তর পড়ালেখা করা লাগবো,তোর হরালেয়া কইরতো অইবো,তর পড়ালেহা করতে হইব,তোর পড়াল্যাহা করতে হইবে
35,তুই কি আর পড়ালেখা করবি নাহ,তুই কি আর ফরালেহা ন গরিবি,তুই কিতা আর পড়ালেখা করতে নানি,তুই কি আর হরালেয়া কইত্তি নও,তুই কি আর পড়ালেহা করতি নাহ?,তুই কি আর পড়াল্যাহা করবি না?
36,তুই কি পড়ালেখা ছেড়ে দিতে চাস,তুই কি ফরালেহা চারি দিতো চস নিকি,তুই কিতা পড়ালেখা ছাড়িত্তে নি?,তুই কি হরালেয়া ছাড়দিয়া লাইতো চাস ?,তুই কি পড়ালেহা ছাইরা দিতে চাস?,তুই কি পড়াল্যাহা ছাইড়া দেতে চাও?
37,তোর কি পড়ালেখা করতে একদমই ভাল লাগে নাহ,তোর কি ফরালেহা গইরতো এব্বেরেও গম ন লাগে,তর কিতা পড়ালেখা করতে এখদম অউ ভালা লাগে নানি,তোর কি হরালেয়া কইত্তে একছের ভালা লাগে না?,তর কি পড়ালেহা করতে এক্কেরেই ভালালাগে নাহ?,তোর কি পড়াল্যাহা করতে এক্কালেই ভালো লাগে না?
38,তুমি কি এখন খেতে বসবা,তুঁই কি এহন হাইতো বইবা নে,তুমি কিতা এখন খানিত বইবায় নি?,তুই কি অন খাইতো বইবি?,তুমি কি এহন খাইতে বইবা,তুমি কি এহন খাইতে ববা?
39,আজকে আমার খেতে ভালো লাগছে না,আযিয়া আঁর হাইতো মনো ন হর,আইজকু আমার খাইতে ভালা লাগের না,আইজগা আর খাইতে ভালা লগের না,আইজকা আমার খাইতে ভালা লাগতাসেনা,আইজগো মোর খাইতে ভালো লাগতেয়াছে না
40,আমার বিদ্যালয়ে অনেক বন্ধু আছে,আঁর বিদ্যালয়ে বউত বন্দু আচে,ইস্কুলো আমার বাক্কা বন্ধু আছে,আর স্কুলে মেলা বনদু আছে,আমার ইস্কুলে অনেক বন্ধু আসে,মোর ইসকুলে ম্যালা দোস্তো আছে
41,আমার ছোট বোন বিদ্যালয়ে যেতে চায় না,আঁর চোড বইন বিদ্যালয়অত যাইত ন চাই,আমার ছুটো বইন ইস্কুলো যাইতে চায় না,আর ছোড বইন স্কুলে যাইতো চায় না,আমার ছোট বইন ইস্কুলে যাইতে চায় না,মোর ছোডো বুইন ইসকুলে যাইতে চায় না
42,আমার বিদ্যালয়ে যেতে অনেক ভাল লাগে,আত্তুন বিদ্যালয়অত যাইত বউত বালা লাগে,আমার ইস্কু্ল যাইতে অনেক ভালা লাগে,আর স্কুলো যাইতো মেলা ভালা লাগে,আমার ইস্কুলে যাইতে অনেক ভালা লাগে,মোর ইসকুলে যাইতে বেমালা ভালো লাগে
43,সে তার গ্রামের একটি বিদ্যালয়ে পড়ালেখা করে,ইবা তার গেরামর এক্কান বিদ্যালয় অত ফরালেহা গরে,হে তার গাউর এখটা ইস্কুলো পড়ে,হেতে  হেতেগো গ্রামে এককান স্কুলে হড়ালেয়া করে,হেয় তার গেরামের একটা ইস্কুলে পড়ালেহা করে,হ্যায় হ্যার গেরামের এউক্কা ইসকুলে পড়াল্যাহা করে
44,সে বিদ্যালয়ে যেতে চায় না,ইবা বিদ্যালয়অত যাইত ন চায়,হে ইস্কুলো যাইতো চায় না,হেতে স্কুলো যাইতো চায় না,হেয় ইস্কুলে যাইতে চায় না,হ্যায় ইসকুলে যাইতে চায় না
45,তার বিদ্যালয়ে গিয়ে পড়ালেখা করতে ভাল লাগে না,ইতাত্তুন বিদ্যালয় অত যাই ফরালেহা গইরতো গম ন লাগে,তার ইস্কুলো গিয়া পড়ালেখা খরতো ভালা লাগে না,হেতের স্কুলে যাই হড়ালেয়া কইরতো ভালা লাগে না,হের ইস্কুলে যায়া পড়ালেহা করতে ভালা লাগে না,হ্যার ইসকুলে যাইয়া পড়াল্যাহা করতে ভালো লাগে না
46,সে বিদ্যালয়ে গিয়ে বন্ধুদের সাথে গল্প করে,ইতে বিদ্যালয় অত যাই বন্দু অক্কলর ফোয়ারে গল্ফ গরে,হে ইস্কুলো গিয়া বন্ধুরার লগে গফ করে,হেতে স্কুলো যাই বনদুগোর লগে গল্ফ করে,হেয় ইস্কুলে যায়া বন্ধুরার সাথে গল্প করে,হ্যায় ইসকুলে যাইয়া দোস্তোগো লগে কেচ্ছা করে
47,সে বিদ্যালয়ের মাঠে প্রতিদিন ক্রিকেট খেলে,ইতে বিদ্যালয় অর মাডঅত ফত্তিন ক্রিকেট কেলে,হে ইস্কুলর মাঠো ফত্তেকদিন ক্রিকেট খেলায়,হেতে স্কুলের মাডো হইত্তোদিন ক্রিকেট খেলে,হেয় ইস্কুলের মাঠে প্রত্যেকদিন ক্রিকেট খেলে,হ্যায় ইস্কুলের মাডে পেরতেকদিন ক্রিকেট খেলে
48,সে বিদ্যালয়ের মাঠে মাথা ঘুরিয়ে পরে গিয়েছিল,ইবা বিদ্যালয় অর মাডঅত মায়া গুরি ফরি গেইয়্যুই,হে ইস্কুলর মাাঠো মাথা গুরাইয়া পরি গেছিল,হেতি স্কুলের মাডো মাতা ঘুরি হড়ি গেছেগই,হেয় ইস্কুলের মাঠে মাথা ঘুরায়া পইড়া গেসিল,হ্যায় ইশকুলের মাডে মাথা ঘুরাইয়া পইড়া গ্যাল্লেহ
