Sentence #,Standard_Bangla,Chittagong,Sylhet,Noakhali,Mymensingh,Barishal
739,এই পৃথিবীতে আমি বড্ড একা,এই ফিতিবিত আঁই খুব একা,ওউ দুউন্নাইত আমি ফুরাউ এখলা,এই হিতিবিতে আই বড্ড একলা,এই দুনিয়াতে আমি বড্ড একলা,এই পিরথিবি তে মুই এক্কেরে একলা
740,তুমি রান্না করতে পারো,তুঁই রাঁদিত যানো নে ?,তুমিতাইন কিতা রান্তায় ফারো নি?,তুউই রান্না কইরতাম হারো,তুমি রান্না করতে পার ?,তুমি কি রানতে পারো?
741,তোমার হাতের লেখা অনেক সুন্দর,তোঁয়ার আতর লেহা বউত সুন্দর,তুমিতাইন ওর হাত ওর লেখা যে সুন্দর,তোয়ার হাতের লেয়া মেলা সুন্দর,তোমার হাতের লেহা মেলা সুন্দর,তোমার হাতের লেহা একছের সুন্দর
742,আমি গল্পের বই কিনবো,আঁই গল্ফর বই কিন্নম,আমি গল্প'র বই কিনমু,আই গল্ফের বই কিনুম,আমি গল্পের বই কিনবাম,মুই গল্পের বই কিনমু
743,আমি আজকে ঢাকায় যাবো,আঁই আযিয়া ডাহা যাইয়্যুম,আমি আইজ ঢাকাত যাইমু,আই আইজগা ঢাকাইয় যাইয়ুম,আমি আইজকে ঢাকায় যায়াম,মুই আইজ ঢাকা যামু
744,ঢাকায় আমার চাকরি হয়েছে,ডাহাত আঁর চঁঅরি অইয়্যে,ঢাকাত আমার চাকরি ওইছে,ঢাকায় আর চাকরি অইছে,ঢাকায় আমার চাকরি হইসে,ঢাকায় মোর চাকরি হইছে
745,চাকরি করতে আর ভালো লাগে না,চঁঅরি গইরত আত্তুন আর গম ন লাগের,চাকরি করতে আর বালা লাগরো না,চাকরি কইরতাম আর ভালো লাগে না,চাকরি করতে আর ভালা লাগে না,মোর চাকরি করতে আর ভালো লাগদেয়াছে না
746,মা আমার অনেক যত্ন নেয়,মা আঁর বঊত যত্ন লয়,মা'য় আমার খুব যত্ন নেইন,আর মা আর মেলা যত্ন করে,মা আমার মেলা যত্ন নেয়,মায় মোর ম্যালা যত্ন লয়
747,আমার মায়ের রান্না অনেক মজার,আঁর মার রাঁদা বউত মযা,আমার মা'র গাত ওর রান্দা খুব মজার,আর মার রান্না মেলা স্বাদ,আমার মায়ের রান্না মেলা মজার,মোর মায়ের রান্দা একছের মজা
748,বিয়েতে আমার মত নাই,বিয়াত আঁর মত নাই,বিয়াত আমার লাকান নাই,বিয়াত আর মত নাই,বিয়াতে আমার মত নাই,বিয়ায় মোর মত নাই
749,পাহাড়ের চূড়ায় উঠতে চাই,ফা আরর আগাত উইটত চায়,পাহাড় ওর মাথাত উঠতাম চাই,ফাহাড়ের চুড়ায় উইটতাম চাই,পাহাড়ের চূড়ায় উঠতাম চাই,পাহাড়ের মাতায় ওঠতে চাই
750,এক পাশে সাগর এক পাশে বালি,এক ফাশে দইরগা এক ফাশে বালু,এক বায়দি সমুদ্র আরেক বায়দি বালু,এক হাস সাগর এক হাসে বালি,এক পাশে সাগর এক পাশে বালি,এক কূলে সাগর আরেক কূলে বালু
751,তোমার ছেলে অনেক দুষ্টু,তোঁয়ার ফোয়া বঊত যারগো,তুমিতাইন ওর ফুয়াগু যে দুষ্টা,তোয়ারে হোলা অনেক দুইষ্ট,তোমার ছেড়া অনেক দুষ্ট,তোমার পোলায় একছের দুষ্টু
752,কালকে থেকে পড়তে বসবো,হালিয়াত্তুন ফইত্ত বইস্সম,কাইল তনে পড়াত বইমু,কাইলগার তুন হইড়তে বইয়ুম,কালকে থাইক্কা পড়তাম বসবাম,কাইল হইতে পড়তে বমু
753,আমার ঘড়ীটা খুজে পাচ্ছি না,আঁর গরিওয়া তোয়ায় ন ফাইর,আমার ঘড়িগুতা খুজিয়া পাইয়ার না,আর গরি আন খুজি হাইয়ের না,আমার ঘড়ীটা খুইজ্জা পাইতাসি না,মোর ঘড়িডা খুইজ্জা পাইতেয়াছি না
754,মানুুষ অনেক স্বার্থপর হয়,মানুষ বউত সার্তফর,মানুষ যে স্বার্থপর ওয়,মানষ মেলা স্বার্থপর,মানুুষ মেলা স্বার্থপর হয়,মানু অনেক স্বার্থপর হয়
755,কিন্তু কিছু মানুষ অনেক ভালো,কিন্তু কিচু মানুষ বউত বালা,কিন্তু কিছু মানুষ খুব বালা,কিন্তু কিছু মানষ মেলা ভালো,কিন্তু কিসু মানুষ মেলা ভালা,তয় কিছু মানু ম্যালা ভালো
756,আমি তাদেরই একজন হতে চাই,আঁই তারার একযন অইত চায়,আমি তারার ওউ একজন ওইতাম চাই,আই হেতাগোরএকজন অইতাম চাঈ,আমি তারারই একজন হইতাম চাই,মুই হ্যাগোরি একজন হইতে চাই
757,তোমার পরিবারে কি আমায় মেনে নিবে,তোঁয়ার ফরিবার কি আঁরে মানি লইব নে?,তুমিতাইন ওর বাসাত কিতা আমারে মানিয়া লইবো নি?,তোয়ার হরিবারে কি আরে মানি লইব,তোমার পরিবারে কি আমায় মাইন্না নিব?,তোমার পরিবার কি মোরে মাইন্না নেবে?
758,তুমি অনেক যত্নশীল,তুঁই বউত যত্নবান,তুমিতাইন যে যত্ন লও,তুউই অনেক যত্নশীল,তুমি মেলা যত্নশীল,তুমি বেমালা যত্নশীল
759,তোমাদের পরীক্ষা কবে,তোঁয়ারার ফরিক্কা হত্তে,তোমরার পরীক্ষা কবে?,তোংগোর হরীক্কা কবে,তোমরার পরীক্ষা কবে ?,তোমাগো পরিক্ষা কবে?
760,খেলার মাঠে আজকে অনেক মানুষ,কেলার মাডত আযিয়া বউত মানুষ,খেলার মাঠও আইজ বাক্কা মানুষ,খেইলবার মাডে অইজগা মেলা মানষ,খেলার মাঠে আইজকে মেলা মানুষ,খেলার মাডে আইজ একছের মানু
761,তুমি ভালো আছো,তুঁই বালা আচে নে,তুমিতাইন বালা নি?,তুউই ভালো আছোনি,তুমি ভালা আসো?,তুমি ভালো আছো?
762,আমি ভালো নেই,আঁই বালা নেই,আমি বালা নায়,আই ভালা নাই,আমি ভালা নাই,মুই ভালো নাই
763,তোমাকে ছাড়া আমি ভালো নেই,তোঁআরে চারা আঁই বালা নেই,তুমিতাইনরে ছাড়া আমি বালা নাই,তোয়ারে ছাড়া আই ভালা নাই,তোমারে ছাইড়া আমি ভালা নাই,তোমারে থুইয়া মুই ভালো নাই
764,বিপদ বলে কয়ে আসে না,বিফদ হইয়েরে ন আইয়্যে,বিফদ কইয়া আয় না,বিফদ বলি কই আইয়ে না,বিপদ বইল্লা কয়া আয় না,বিপদ বইল্লা কইয়া আহে না
765,ছেলেটির রাগ অনেক বেশী,ফোয়াইবার গোস্সা বেশি,ফুয়াগুর যে রাগ,হোলাগার রাগ মেলা বেশি,ছেড়াডার রাগ মেলা বেশী,পোলাডার ত্যাজ একছের বেশী
766,আমি একজন খারাপ মানুষ,আঁই একযন হারাপ মানুষ,আমি একটা বাদ মানুষ,আই একজন খারাপ মানষ,আমি একজন খারাপ মানুষ,মুই এউক্কা খারাপ মানু
767,তুমি কি চাও,তুঁই কি চ?,তুমিতাইন কিতা চাও তে?,তুউই কিয়া চাও,তুমি কিতা চাও?,তুমি কি চাও?
768,তুমি কি চাও আমি চলে যাই,তুঁই কি চ আঁই যাই গই?,তুমিতাইন কিতা চাও নি আমি যাই গি?,তুমি কিয়া চাও আই চলি যাই,তুমি কি চাও আমি চইল্লা যাই?,তুমি কি চাও মুই চইল্লা যাই?
769,আমি চাই তুমি সবসময় আমার সাথে থাকো,আঁই চাই তুঁই এগাযা আঁর ফোঁয়ারে তাকো,আমি চাই তুমিতাইন হকল সময় আমার লগে থাকো,আই চাই তুউই সবসময় আর সাথে থাকো,আমি চাই তুমি বেগসময় আমার লগে থাকো,মুই চাই তুমি হগলকালে মোর লগে থাহো
770,কিন্তু এইটা কোনদিনও সম্ভব না,কিন্তু ইয়ান হনোদিনো সম্বব ন,কিন্তু ইকটা কোনদিন ওউ সম্ভব নায়,কিন্তু এইটা কোনদিন ও সম্ভব অইত ন,কিন্তু এইডা কোনদিনও সম্ভব না,তয় এইডা কোনকালেই সম্ভব না
771,তুমি কি বিয়েতে রাজি,তুঁই বিয়াত রাযি নে ?,তুমিতাইন কিতা বিয়াত রাজি নি?,তুউই কি বিয়াত রাজি,তুমি কি বিয়াতে রাজি ?,তুমি কি বিয়াতে রাজি?
772,আমি রাজি না,আঁই রাযি ন,আমি রাজি নায়,আই রাজি নো,আমি রাজি না,মুই রাজি না
773,পাখিটা দেখতে সুন্দর,ফাকিউয়া দেকতে সুন্দর,পাখি ওগু দেখতে সুন্দর,পাখিটা দেইকতো সুন্দর,পাখিডা দেখতে সুন্দর,পক্ষিডা দ্যাখতে সুন্দর
774,লাল রঙের শাড়িতে তোমায় ভালো মানাবে,লাল রংর শাড়িত তোঁয়ারে বালো মানাবোব,লাল রঙ ওর শাড়িত তোমারে বালা মানাইবো,লাল রঙ্গের শাড়িত তোয়ারে ভালা মানাইবো,লাল রঙের শাড়িতে তোমরে ভালা মানাইব,লাল রঙের শারিতে তোমারে ভালো মানাইবে
775,নীল রঙ আমার অনেক পছন্দ,নীল রং আঁর বউত পচন্দ,নীল রঙ আমার খুব বালা লাগে,নীল রং আর অনেক হছন্দ,নীল রঙ আমার মেলা পসন্দ,নীল রঙ মোর ম্যালা পিরিয়ো
776,আমি তোমায় ভালবাসি না,আঁই তোয়াঁরে বালো ন বাসি,আমি তোমারে বালা ফাই না,আই তোয়ারে ভালোবাসি না,আমি তোমায় ভালবাসি না,মুই তোমারে ভালোবাসি না
777,কেন ভালোবাসো না আমায়,আঁরে বাল না বাসো কিল্লাই ?,কিতার লাগি আমারে বালা ফাও না?,কিল্লাই আরে ভালোবাসো না,কেন ভালোবাস না আমায় ?,কির লইজ্ঞা ভালোবাসনা মোরে?
778,আমার মধ্যে সমস্যা আছে,আঁর মইদ্দে সমস্যা আচে,আমার মাঝে বেজাল আছে,আর মইধ্যে সমস্যা আছে,আমার মধ্যে সমস্যা আসে,মোর মইধ্যে সমেস্যা আছে
779,আমার মাথা গরম থাকে,আঁর মাতা গরম তাকে,আমার মাথা গরম ওই থাকে,আর মাতা গরম থায়,আমার মাথা গরম থাহে,মোর মাতা গরম থাহে
780,আমি বদমেজাজি লোক,আঁই টেরা মানুষ,আমি বদ মেজাজ ওর মানুষ,আই বদমেজাজি মানষ,আমি বদমেজাজি বেডা,মুই বদমেজাজি মানু
781,বেশী কথা আমার পছন্দ না,বেশি হতা আত্তন পচন্দ নয়,বেশি মাত আমার বালা লাগে না,বেশি কতা আর হছন্দ নো,বেশী কথা আমার পসন্দ না,বেশী কতা মোর পছন্দ না
782,তুমি বোকা একজন মানুষ,তুঁই একযন ডিলা মানুষ,তুমিতাইন একটা গাধা মানুষ,তুউই একজন বেকুব মানুষ,তুমি বোকা একজন মানুষ,তুমি গোঙ্গা এউক্কা মানু
783,তুমি বেশী কথা বলো,তুঁই বেশি হতা হ,তুমিতাইন বেশি মাতো,তুউই বেশি কতা কও,তুমি বেশী কথা কও,তুমি বেশী কতা কও
784,তুমি অল্প কথা বলো,তুঁই অল্ফ মাতো,তুমিতাইন কম মাতো,তুউই কম কতা কও,তুমি অল্প কথা কও,তুমি কম কতা কও
785,আমি আজ সকালে চা খাই নাই,আঁই আযিয়া বেইন্না চা না হাই,আমি আইজ সকাইলকু চা খাইছি না,আই আইজগা সকালে চা খাই নো,আমি আইজকে সহালে চা যাই,মুই আইজ বেইন্নাকালে চা খাইনাই
786,আমি আজ সকালে আমার বন্ধুদের সাথে ঘুরতে গিয়েছিলাম,আঁই আযিয়া বেইন্না আঁর বন্দুর লই গুইর ত গেইলাম,আমি আইজ সকালে আমার বন্ধু ওকলতোর লগে ঘুরাত গেছলাম,আই আইজগা সকালে আর বন্দুগোর লগে ঘুইরতাম গেছি,আমি আইজকে সহালে আমার বন্ধুরার সাথে ঘুরতে গেসিলাম,মুই আইজ বেইন্নাকালে দোস্তগো লগে ঘোরতে গেল্লাম
787,আমি আজ সকালে আমার বন্ধুর সাথে ঝগড়া করেছি,আঁই আযিয়া বেইন্না আঁর বন্দুর লই হইজ্জা গইরগি,আমি আইজ সকাইলকু আমার বন্ধু ওগুর লগে ঝগড়া করছি,আই আইজগা সকালে আর বন্দুর লগে কাইজ্জা কইচ্ছি,আমি আইজকে সহালে আমার বন্ধুরার লগে ঝগড়া করসি,মুই আইজ বেইন্নাকালে মোর দোস্তের লগে কাইজ্জা করছি
788,আমার বন্ধু আমার সব কথা খুবই মনোযোগ দিয়ে শুনে,আঁর বন্দু আঁর বেজ্ঞিন হতা কুব মনোযোগ দি ফুঁনে,আমার বন্ধু ওতায় আমার মাত খুব মন দিয়া হুনে,আর বন্দু আর বেক কতা মনযোসহকারে হুনে,আমার বন্ধু আমার বেগ কথা খুবই মনোযোগ দিয়ে হুনে,মোর দোস্ত মর হগল কতা মন দিয়া হোনে
789,আমার বন্ধু হয়ত আমাকে অনেক ভালবাসে,আঁর বন্দু আঁরে বউত বালবাসে ফঁল্লাই,আমার বন্ধু ওকলতে মনয় আমারে খুব বালা ফাও,আর বন্দু মনে হয় আরে মেলা ভালোবাসে,আমার বন্ধু হয়ত আমারে মেলা ভালবাসে,মোর দোস্ত ত্যায় মোরে বেমালা ভালোবাসে
790,আমার একটি বিড়াল আছে,আঁর উজ্ঞা বিলাই আচে,আমার একগু বিলাই আছে,আর এককান বিলাই আছে,আমার একটা বিলাই আসে,মোর এউক্কা বিলই আছে
791,আমার বিড়ালের নাম মিনু,আঁর বিলায়র নাম মিনু,আমার বিলাই ওর নাম মিনু,আর বিলাইর নাম মিনু,আমার বিলাইয়ের নাম মিনু,মোর বিলইর নাম মিনু
792,আমি আমার বিড়ালের সাথে খেলতে অনেক ভালবাসি,আঁই আঁর বিলায়র লই খেলা হাইত বঊত বালবাসি,আমি আমার বিলাই ওর লগে খেলতে যে বালা ফাই,আই আর বিলাইড় লগে খেইলতা অনেক ভালোবাসি,আমি আমার বিলাইয়ের লগে খেলতে মেলা ভালবাসি,মুই মোর বিলইর লগে খ্যালতে ম্যালা ভালবাসি
793,এই চৌদ্দ টি বছরে আজও কোন কারনে উনি আমাকে তুই বলে ডাকেনি,"এই ১৪ বছর লতি আইজো হনো হারনে ইবা আঁরে ""তুই"" হই ন ডাকেনে","ওয় ১৪ টা বছর ধরি আইজও তাইন কোন কারণে আমারে ""তুই"" কইয়া ডাকছোইন না","এই ১৪ বছরে আইজ ও হেতনে কোনদিন ও কোনকারনে আরে ""তুই"" করিও কয় নো","এই ১৪ টি বছরে আজও কোন কারনে হেয় আমারে ""তুই"" কয়া ডাহে নাই ","এই ১৪ ডা বছর আইজও কোন কারনে হ্যায় মোরে ""তুই"" কইয়া বোলায়নাই"
794,কখনো গায়ে হাত তুলে নি,হনত্তে গাআত আত ন তুলে,কোন বালা গাত হাত তুলছে না,কোন সময় গায়ে আত তুলে নো,কহনো গায়ে হাত তুলে নাই,কহনো গায়ে হাত তোলে নাই
795,লোক দেখানো শেষ,লোক দেহানো অয় গিয়োই নে?,মাইনষরে দেখানি শেষ না নি?,লোক দেয়ানো শেষ,লোক দেহানু শেষ?,মানু দ্যাহাইন্না শ্যাষ?
796,এত তাড়াতাড়ি শেষ,এতো জলদি শেষ অই গিয়োয়?,ওতো জলদি শেষ!!,এত জলদি শেষ,এত তাড়াতাড়ি শেষ,এত হওয়ালে শ্যাষ?
797,বুঝতেছিনা কি করবো আমি,নো বুঝির কি গইজ্জুম,বুঝিয়ার না কিতা করতাম আমি,"বুইঝতাম আছি না, কি কইরগুম আই! ",বুঝতাসিনা কিতা করবাম আমি,বোঝতেপারতেয়াছিনা কি করমু মুই
798,আমার দুই বিয়ে হয়েছে,আর দুইয়ান বিয়া অইয়ে,আমার দুইগু বিয়া ওইছে,আর দুগা বিয়া অইছে,আমার দুই বিয়া হইসে,মোর দুজ্ঞা বিয়া হইছে
799,আমি একজন মেয়ে মানুষ,আই এইজ্ঞো বেডি মানুষ,আমি একগু ফুরি মানুষ,আই ওকগা মাইয়া মানুষ,আমি একজন মেয়ে মানুষ,মুই এউক্কা মাইয়া মানু
800,আমার দ্বিতীয় বিয়ে নিয়ে আমার নিজের কাকারা মামারা খোঁচা মেরে কথা বলে,আর মামারা আর কাকারা দ্বিতীয় বিয়া লই গুতা মারি খতা কো,আমার দুই নাম্বার বিয়া লইয়া আমার নিজ ওর কাকা-মামাইন্তে খোঁচা মারিয়া মাতোইন,"আর দ্বিতীয় বিয়া লই আর নিজের কাগুরা, মামুরা  আরে খোডা মারি কতা কয় ","আমার দ্বিতীয় বিয়া নিয়া আমার নিজের কাক্কারা, মামারা খোঁচা মাইরা কথা কয়","মোর দুইনাম্বার বিয়া লইয়া মোর নিজের চাচারা, মামারা খোঁচা মাইররা কথা কয়"
