Sentence #,Standard_Bangla,Chittagong,Sylhet,Noakhali,Mymensingh,Barishal
1477,আমি কি বোকা,আই কি বলদ নে?,মুই যে আরুয়া?,আই কি বেক্কল ?,আমি কিতা বেক্কল?,মুই কি গোঙ্গা?
1478,তুমি অনেক চালাক,তুই বত বড় সেয়ানা,তুমি রেবা বহুত চালু,তুমি অনেক চালাক,তুমি মেলা চালাক,তুমি বেমালা শেয়ান
1479,আমি বার বার ভালোবেসে ঠকে গেছি,আই বারবার মঅব্বত গরি ধরা হাই,মুুই বার বার পিরিত খরি ঠকলাম,আই বার বার ভালোবাসি ঠকি গেছি,আমি বার বার ভালোবাইসসা ঠইক্কা গেসি,মুই ক্যাল ক্যাল ভালোবাইস্যা ঠইগ্যা গ্যাছি
1480,ভালোবাসা অনেক কষ্টের,মঅববত বত হষ্টের,পিরিত বাক্কা খষ্টর,ভালোবাসা অনেক কষ্টের,ভালবাসা মেলা কষ্টের,ভালোবাসা ম্যালা কষ্টের
1481,তোমার এক ফোটা হাসি দেখার জন্য বসে আছি,তোয়ার এক্কান হাসি দেইবারলাই বই আসি,তুমার এখ জরা হাসি দেখার লাগি বই রইছি,তোয়ার এক হোটা আসি দেনের লাই বই রইছি,তোমার এক ফোটা হাসি দেহনের লাইজ্ঞা বয়া আসি,তোমার এক ফোডা হাসি দ্যাহার লইজ্ঞা বইয়া আছি
1482,একটু আগেই ঝাড়ু দেওয়া হয়েছে,এক্কানা আগে ঝাড়ু মারা ওইয়্যে,থুরা আগেউ ঝাড়ু দেওয়া অইছে,এককানা আগেই ঝাড়ু দেয়া অইছে,একটু আগেই ঝাড়ু দেওয়ন হইসে,এট্টু আগেই ঝারু দেওয়া হইছে
1483,পানি দিয়ে মুছে দেওয়া হয়েছে,ফানি দিয়েনে দুই দিইয়্যে,পানি দিয়া মুছি দেওয়া অইছে,হানি দি মুছি দেন অইছে,পানি দিয়া মুইচ্ছা দেওয়ন হইসে,পানি দিয়া মুইছ্যা দেওয়া হইছে
1484,শিক্ষার্থী নতুন ভর্তি হয়েছে,শিক্ষার্থী নতুন ভর্তি অইয়ে,ছাত্রছাত্রী নয়া ভর্তি অইছইন,শিক্ষার্থী নতুন ভর্তি অইছে,শিক্ষার্থী নতুন ভর্তি হইসে,শিক্ষার্থী নতুন ভর্তি হইছে
1485,এলাকায় আগুন লেগেছে,এলাকাত অন লাইগ্গে,এলাকাত আগুন লাগি গেছ,এলাকাত আগুন লাইগছে,এলাকায় আগুন লাগসে,এলাকায় আগুন লাগছে
1486,আমার নানা অসুস্থ,আর নানা গম নাই,মোর  নানা বেমার,আর নানা অসুস্থ,আমার নানা অসুস্থ,মোর নানা অসুস্থ
1487,অনেক শিক্ষার্থী নতুন ভর্তি হয়েছে,বহুত শিক্ষার্থী নতুন ভর্তি অইয়ে,বাক্কা ছাত্রছাত্রী নয়া ভর্তি অইছইন,অনেক শিক্ষার্থী নতুন ভর্তি অইছে,অনেক ছাত্র ছাত্রী  নতুন ভর্তি হইসে,বেমালা শিক্ষার্থী নতুন ভর্তি হইছে
1488,রোগীকে হাসপাতালে থাকতে হবে,রোগিরে হাসপাতালত তাহন ফরিবু,বেমারিরে হাসপাতাল থাখা লাগবো,রোগীরে হাসপাতালে থাইকতে অইবো,রোগীরে হাসপাতালে থাকতে হইব,রুগীরে হাসপাতালে থাকতে হইবে
1489,নানাকে দেখতে গিয়েছিলাম,নানারে চাইতু গেইলাম,নানারে দেখাত গেছলাম,নানারে চাইতে গেছিলাম,নানাকে দেখতে গেসিলাম,নানারে দ্যাখতে গ্যালাহম
1490,আমি আগে দেখিনি,আই আগে নো‌ চাই,মুই আগে দেখছি না,আই আগে দেইনো,আমি আগে দেহি নাই,মুই আগে দেহিনাই
1491,নানা আমাকে দেখে খুব খুশি হলো,নানা আরে চাই হুশি অইয়্যে,নানায় মোরে দেকিয়া বেতালা খুশ অইছইন,নানা আরে দেই খুব খুশি অইছে,নানা আমারে দেইক্ষা খুব খুশি হইল,নানা মোরে দ্যাইকখা বেমালা খুশি হইছে
1492,সেটা একধরনের যোগাযোগ,ইবে একডৈল্লে যোগাযোগ,ইখটা এখ ধরনর যুগাযুগ,হেইডা একধরনের যোগাযোগ,হেইডা একধরনের যোগাযোগ,হেইডা একরহমের যোগাযোগ
1493,আমি গতকাল স্কুলে আসিনি,আই গতকাল স্কুলত নো যাই,মুই কাইলকু ইস্কুল আইছি না,আই গতকাল স্কুলে আইনো,আমি গতকাল ইস্কুলে আইনাই,মুই গ্যাছেকাইল ইস্কুলে আইনাই
1494,তাদেও কেও স্কুলে আসেনি,ইতারা কেউ স্কুলত নো যাই,তারার কেউ ওউ স্কুলও আইছে না,হেতাগো কেও স্কুলে আইয়ে ন,হেরার কেও ইস্কুলে আয়নাই,হ্যাগোও কেউ ইস্কুলে আয়নাই
1495,তাদের জানার কথা নয়,ইতারা জানিবের হতা নো,তারার জানার কথা নায়,হেতাগো জানার কতা ন,হেরার জানার কথা না,হ্যাগো জানার কথা না
1496,বড়ো মামা বিদেশ থেকে এসেছেন,বড় মো বিদেশুরতুন আইস্যে,বড়ো মামা বিদেশ তনে আইছোইন,বড়ো মামা  বিদেশ তুন আইছেন,বড় মামা  বিদেশ থাইক্কা আইসেন,বড় মামা বিদেশে গোনে আইছে
1497,ক্লাসে কোন বিষয় নিয়ে কথা বলছিলেন,ক্লাসত হোন বেফারে হতা হইয়্যে?,ক্লাস-ও কোন ব্যাপারে মাতছিলায়?,ক্লাসে কোন বিষয় লই কতা কইছিলেন?,ক্লাসে কোন বিষয় নিয়া কথা কইসিলেন?,কেলাশে কোন বিষয় লইয়া কথা কইতেয়াছেলেন?
1498,কেন পলাশের কথায় বিরক্ত হয়েছিল,পলাশর হতাত বিরক্ত কিললাই অইলে?,পলাশ ওর মাতে বিরক্ত ওইছলায় কিওর লাগি?,কিল্লেই হলাশের কথাত বিরক্ত অইছিলো?,কেরে পলাশের কথায় বিরক্ত হইসিল?,কির লইজ্ঞা পলাশের কথায় বিরক্ত হইল্লেহ?
1499,ইচ্ছা ছিল কোনো জায়গায় ঘুরতে যাব,ইচ্ছে আসিল হোনো মিক্কে ঘুইরতু যাইয়্যুম,ইচ্ছা আছিল কোন জেগাত ঘুরাত যাইমু,ইচ্ছা আছিলো কোনো জায়গাত ঘুইরতাম যাইয়ুম,ইচ্ছা আসিল কোনো জায়গায় ঘুরতাম যায়াম,ইচ্ছা আল্লেহ কোন হানে ঘোরতে যামু
1500,অনেকবার লালবাগ কেল্লার কথা শুনেছি,বোতবার লালবাগ হেল্লার হোতা উইন্নি,বউতবার লালবাগ কেল্লার মাত হুনছি,অনেকবার লালবাগ কেল্লার কতা হুইনছি,অনেকবার লালবাগ কেল্লার কথা হুনসি,ম্যালাবার লালবাগ কেল্লার কথা হুনছি
1501,ঠিক করা হলো সবাই মিলে সেখানে যাব,ঠিক‌ গোরন‌ অইলে বেকে মিলে এডে যাইউম,ঠিক ওইলো হকলে মিলিয়া ওনো যাইমু,ঠিক করা অইলো বেকে মিলি হিয়ানে যাইয়ুম,ঠিক করা হইলো সবাই মিল্লা ওইহানে যায়াম,ঠিক করা হইছে হগলডি মিল্লা হেইহানে যামু
1502,আমার মামাতো বোনও যেতে চাইল,আর মতো বইন ও যাইতু আসিল,আমার মামাত্তো বইন-ও যাইতো চাইছিল,আর মামতো বোনও যাইতে চাইলো,আমার মামাতো বইনও যাইতে চাইল,মোর মামাতো বুইনও যাইতে চাইছে
1503,লিখে শিক্ষকের কাছে জমা দাও,লিহি এনে মাষ্টর অর হাসোত জমা দে,লেখিয়া শিক্ষক ওর ধারো জমা দেও,লেই শিক্ষকের কাছে জমা দাও,লেইক্ষা শিক্ষকের কাছে জমা দেও,লেইখ্যা শিক্ষকের ধারে জমা দেও
1504,সব অঞ্চলের মানুষের ভাষা এক রকমের নয়,বেক অঞ্চল অর মাইনষের ভাষা‌ এক‌ডইল্লে নই,হকল জেগার মাইনষের ভাষা একলাকান নায়,বেক অঞ্চলের মাইনষের ভাষা এক রকমের ন,বেগ অঞ্চলের মাইনষের ভাষা এক রহমের না,হগল এলাকার মানের ভাষা এক রহম না
1505,অনেক শব্দের উচ্চারণ আলাদা হয়,বোত শব্দের উচ্চারণ এক এক রহমর অই,বউত শব্দ'র উচ্চারণ আলাদা ওয়,অনেক শব্দের উচ্চারণ আলাদা অয়,মেলা শব্দের উচ্চারণ আলাদা হয়,ম্যালা শব্দের উচ্চারন ভিন্ন হয়
1506,দক্ষিণের জেলা কক্সবাজার,দইন অর জেলা হক্সবাজার,দক্ষিণ ওর জেলা কক্সবাজার,দইণের জেলা কক্সবাজার,দক্ষিণের জেলা কক্সবাজার,দক্ষিনের জেলা কক্সবাজার
1507,সাড়ে চারটায় সবার মাঠে আসার কথা,সাড়ে চারটার সমত বেকের মাডত আইবের হতা,সাড়ে চাইট্টাত হক্কল ওর মাঠ-ও আওয়ার কথা,সাড়ে চাইরটায় বেকে মাঠে আইয়নের কতা,সাড়ে চারটায় বেহের মাঠে আওনের কথা,সাড়ে চাইরটায় হগলডির মাডে আওয়ার কথা
1508,আজ কোনো খেলা হবে না,আজিয়ে হোনো খেলা অইতু নো,আইজ কোন খেলা ওইতো নায়,আইজ কোনো খেলা অইতো ন,আইজ কোন খেলা হইতো না,আইজগো কোনো খ্যালা হইবে না
1509,একটা পোড়োবাড়ি আছে,উগ্গো পোড়াবাড়ি আছে,একগু পোড়াবাড়ি আছিল,ওকগা হোড়াবাড়ি আছে,একটা পোড়োবাড়ি আসে,এউক্কা পোড়াবাড়ি আছে
1510,এখানে কী করছো তোমরা,এডে কিত্তে লাইগ্গু তোরা,ওনো কিতা কররায় তোমরা?,ইয়ানে কী কইরতেছো তোমরা?,এইহানে কী করতাসো তোমরা?,এইহানে কি করতেয়াছো তোমরা?
1511,চারপাশে কত বড়ো বড়ো গাছ,চারিমিক্কে হতর হতর‌ গাছ,চাইরো দিকে কতো বড় বড় গাছ,চাইরপাশে কত্ত বড্ডা বড্ডা গাছ,চাইরপাশে কত বড় বড় গাছ,চাইরদিক কত্ত বিশাল বিশাল গাছ
1512,দিনের বেলাতেও বাড়ির ভিতরটা অন্ধকার হয়ে থাকে,দিন অর বেলাত অ বাড়ির ভিতুর আন্ধা অই‌ তাহে,দিন ওর বেলাতও বাড়ির ভিতরটা অন্ধকার ওই থাকে,দিনের বেলাত ও বাড়ির ভিতরকান অন্ধকার অই থায়,দিনের বেলাতেও বাড়ির ভিতরডা অন্ধকার হয়া থাকে,দিনের কালেও ভাড়ির ভিতরে আন্ধার হইয়া থাহে
1513,রেলগাড়ি চলে রেললাইনের উপর দিয়ে,রেলগাড়ি চলে রেললাইনর উওদ্দিয়েরে,রেলগাড়ি চলেউ রেললাইন ওর উফ্রে দিয়া,রেলগাড়ি চলে রেললাইনের উপর দি,রেলগাড়ি চলে রেললাইনের উপরে দিয়া,রেলগাড়ি চলে রেললাইনের উপরে দিয়া
1514,উপহার পেতে প্রত্যেকের ভালো লাগে,উপহার ফাইতু বেগ্গুনুরতুন ভালা লাগে,উপহার ফাইতে সবের ওয় বালা লাগে,উপহার হাইতে বেকের ভালা লাগে,উপহার পাইতে বেহের ভালা লাগে,উপহার পাইতে পেরতেকের ভালো লাগে
1515,অচেনা লোকের উপহার গ্রহণ করি না,অচেনা লোকর উফহার গ্রহন নো গরি,অচেনা মাইনষের উপহার লই না,যেতাগোরে চিনিনা হেতাগো উপহার গ্রহণ করি না,অচেনা লোকের উপহার গ্রহণ করি না,অচেনা লোকের উপহার লই না
1516,উপহার দিতে অনেকের ভালো লাগে,উপহার দিতু বেগ্গুনুরতুন ভালা লাগে,উপহার দিতে বউত ওর বালা লাগে,উপহার দিতে অনেকের ভালা লাগে,উপহার দিতে অনেকের ভালা লাগে,উপহার দেতে অনেকের ভালো লাগে
1517,খেলার মাঠে আমরা রোজ খেলতে যাই,হেলার মাডত আরা রোজ কেলিবের লাই যাই,খেলার মাঠ-ও আমরা রোজ খেলাত যাই,খেলার মাডে আমরা রোজ খেইলতে যাই,খেলার মাঠে আমরা রোজ খেলতাম যাই,খ্যালার মাডে মোরা পেরতেকদিন খ্যালতে যাই
1518,এক চানাচুরওয়ালাকে দেখা যায়,এক্কান চানাচুরবালত দেহা যায়,একটা চানাচুরআলারে দেখা যাইরো,ওকগা চানাচুরওয়ালারে দেয়া যায়,এক চানাচুরওয়ালারে দেহন যায়,এউক্কা চানাচুরয়আলারে দ্যাহা যায়
1519,তিনি চানাচুর বিক্রি করতে আসেন,তিনি চানাচুর বেসিবেল্লাই আইয়ে এডে,তাইন চানাচুর বেচাত আইন,হেতে চানাচুর বেইচতে আইয়ে,হেয় চানাচুর বেচতে  আয়,হ্যায় চানাচুর বেচতে আইতে
1520,তুমি ভালো আছ জেনে খুশি হলাম,তুই গম আসোস জানি এনে খুশি অইলাম,তুমিতাইন বালা আছো জানিয়া খুশি ওইলাম,তুমি ভালো আছি জানি খুশি অইলাম,তুমি ভালা আস জাইন্না খুশি হইলাম,তুমি ভালো আছো জাইন্না খুশি হইলাম
1521,চিঠি সাধারণত খামে ভরে পাঠানো হয়,চিঠি সাধারণত হামত ভরি এনে ফাডায়,চিঠি সাধারণত খাম ওর মাঝে ভরিয়া পাঠানি ওয়,চিঠি সাধারণত খামে ভরি হাডানো অয়,চিঠি সাধারণত খামে ভইরা পাঠানো হয়,চিঠি সাধারণত খামে ভইররা পাডানো হয়
1522,খাওয়া দাওয়ার কথা বলে লাভ নেই দুঃখ পাবে,"খন-দন অর হতা হই লাভ নাই ,হষ্ট ফাবে","খানির দানির মাত মাতিয়া লাভ নাই, কষ্ট ফাইবায়","খাওন দাওনের কতা কই লাভ নাই, দুঃখ হাইবা","খাওয়া-দাওয়ার কথা কয়া লাভ নাই, দুঃখ পাইবা",খাওন দাওনের কথা কইয়া লাভ নাই দুক্ষ পাবা
1523,তবে বেঁচে আছি ও খুব ভালো আছি,বাচি আসি ভালা ও আসি,তবে বাচিয়া আছি আর খুব বালাও আছি,তবে বাঁচি আছি আর খুব ভালা আছি,তবে বাইচ্চা আসি ও খুব ভালা আসি,তয় বাইচ্চা আছি আর ম্যালা ভালো আছি
1524,তোমরা ভালো আছ জেনে খুশি হলাম,তোওয়ারা ভালো আছ জানিয়েরে কুশি অইলাম,তোমরা বালা আছো জানিয়া খুশি ওইলাম,তোমরা ভালো আছ জানি খুশি অইলাম,তোমরা ভালা আস জাইন্না খুশি হইলাম,তোমরা ভালো আছো জাইন্না খুশি হইলাম
1525,আমার জন্য বেশি চিন্তা কোরো না,আর লাই চিন্তা নো গইজ্জ,আমার লাগি বেশি ভাবিও না,আর লাই বেশি চিন্তা কইরো না,আমার লাইজ্ঞা বেশি চিন্তা কইরো না,মোর লইজ্ঞা বেশি চিন্তা কইররো না
1526,এখন ঘরে ঘরে টেলিভিশন দেখা যায়,এহন গরত গরত টেলিভিশন দেহা যার,ওখন ঘর-ও ঘর-ও টিভি দেখা যায়,অন ঘরে ঘরে টেলিভিশন দেন যায়,এহন ঘরে ঘরে টেলিভিশন দেহন যায়,এহন বারতে বারতে টিভি দ্যাহা যায়
1527,টেলিভিশনে কথা শোনা যায় ছবিও দেখা যায়,টেলিভিশনর হতা ফুনা যায় আর ছবিও দেহা যায়,"টিভিত মাত হুনা যায়, ছবিও দেখা যায়","টেলিভিশনে কতা হুনা যায়, ছবিও দেন যায়","টেলিভিশনে কথা হুনা যায়, ছবিও দেহা যায়",টিভিতে কথা হুনা যায় ছবিও দ্যাহা যায়
1528,রেডিওতে কেবল কথা শোনা যায়,রেদিওত হাইল্লে হতা ফুনা যায়,রেডিওত খালি মাত হুনা যায়,রেডিওত এলা কতা হুনা যায়,রেডিওতে কেবল কথা হুনা যায়,রেডিওতে খালি কথা হুনা যায়
1529,হাজার বছর আগে সব পুরুষই পরত ধুতি পরত,আজার বছর আগদ্দি বেয়াগ ফুরুষই ধুতি ফইত্তো,হাজার বছর আগ ওর হকল বেটাইনতেউ ধুতি পড়তো,হাজার বছর আগে বেক বেডারাই ধুতি হইরতো,হাজার বছর আগে বেগ পুরুষই পরত ধুতি পরত,হাজার বছর আগে হগল ব্যাডাই ধুতি পরতে
1530,তখনো মেয়েরা আঁচল টেনে ঘোমটা দিত,তহনো মাইয়াফোয়ারা আচল টানিয়েরে মুখ ডাহিতো,তখনো ফুরিন আঁচল টানিয়া ঘোমটা দিতো,হেক্তেও মাইয়ারা আঁচল টানি ঘোমটা দি্তো,তহনো মাইয়ারা আঁচল টাইন্না ঘোমটা দিত,তহন মাইয়ারা আঁচল টাইন্না ঘোমটা দেতে
1531,ভাত বাঙালির বহুকালের প্রিয় খাদ্য,ভাত বাঙালি বহুকালোর ফ্রিয় হানা,ভাত বাঙালির বউতকাল ধরি প্রিয় খানি,ভাত বাঙালির বহুকালের প্রিয় খাদ্য,ভাত বাঙালির মেলাকালের প্রিয় খাদ্য,ভাত বাঙ্গালির বহুকালের প্রিয় খাওন
