Sentence #,Standard_Bangla,Chittagong,Sylhet,Noakhali,Mymensingh,Barishal
2250,আপনার কি এখনও আপনার ভালোবাসার মানুষটার কথা মনে পড়ে,অনের কি এহোন অনের ভালোবাসার মানুষ ইবার হতা মনত ফরে না,আফনার কিতা এখনও আফনার ভালোফাওয়ার মানুষটার মাত মনে পড়ে,আন্নের কি অনো আর ভালোবাসার মানুষগার কতা মনে হড়ে,আফনের কি এহনও আফনের  ভালবাসার মানুষটার কথা মনে পড়ে?,আমনের কি এহনো আমনের ভালবাসার মানের কথা মনে পরে
2251,তোমার সাথে দেখা হলেই পুরাতন ইতিহাস মনে পড়ে যায়,তোয়ার ফোয়ারিত দেহা অইলেই ফুরান ইতিহাস মনত ফরে দে,তোমার লগে দেখা হলেই আগর  ইতিহাস মনে পড়ে যায়,তোয়ার লগে দেখা অইলেই পূরান ইতিহাস মনে হড়ি যায়,তোমার লগে দেহা হইলেই পুরান ইতিহাস মনে পইড়া যায়,তোমার লগে দ্যাহা হইলেই পুরান ইতিহাস মনে পইররা যায়
2252,এই ছবির নীল আকাশ অনেক সুন্দর,এই ছবি ইয়ানর নিল আকাশ বহুত সুন্দর,এই ছবির নীল আকাশ অনেক সুন্দর,এই ছবির নীল আকাশ মেলা সুন্দর,এই ছবির নীল আকাশ মেলা সুন্দর,এই ছবির নীল আকাশ বেমালা সুন্দর
2253,তুমি এক সন্ধ্যায় অফিস থেকে বাসায় ফিরে দেখবে আমি আর নেই,তুই এক সন্ধাত আফিসেত্তুন বাসায় আইয়েরে দেখিবা আই আর নাই,তুমি এক হাইনজা অফিসে থাকি বাসায় ফিরে দেখবা মুই আর নাই,তুই এক সন্ধ্যায় অফিসের তুন বাসাত আই দেইকবা আই আর নাই,তুমি  এক সন্ধ্যায় অফিস থাইক্কা বাসায় ফিরা দেখবা আমি আর নাই,তুমি এক সন্ধ্যায় অফিসে গোনে বাড়ি ফিররা দ্যাখবা মুই আর নাই
2254,তোমার কন্যা তোমাকে অনেক ভালবাসে,তোওয়ার মাইয়া ফোইয়া তোয়ারের বহুত ভালোবাসে দে,তোমার কইন্না তোমারে অনেক ভালাফায়,তোয়ার কইন্যা তোয়ারে মেলা ভালোবাসে,তোমার মাইয়া তোমারে মেলা ভালবাসে,তোমার মাইয়া তোমারে বেমালা ভালবাসে
2255,আমার মাঝে মাঝে চিৎকার করে কাঁদতে ইচ্ছে করে,আর মাঝে মাঝে চিল্লাইয়েরে হাইন্তাম মনত চায় দে,আমার মাঝে মাঝে চিৎকার করিয়া কান্দিতে জানে কয়,আর মাঝে মইধ্যে চিল্লাই কাইনতাম ইচ্ছা হয়,আমার মাঝে মাঝে চিক্কুর দিয়া কাঁনতে ইচ্ছা করে,মোর মাঝে মাঝে চিল্লাইয়া কানতে ইচ্ছা করে
2256,তুমি চলে যাওয়ার পর আমার জীবন থেমে গেছে,তুই চোলি জাইবার ফরদ্দি আর আর জীবন থামি গিয়ি,তুমি চলে যাওয়ার পর আমার জীবন থামিয়া গেজে,তুই চলি যাইবার হরে আর জীবন থামি গেছে,তুমি চইল্লা যাওনের পর আমার জীবন থাইম্মা গেসে,তুমি চইল্লা যাওয়ার পর মোর জীবন থাইম্মা গ্যাছে
2257,আমার ছোট বোন কেমন যেন শান্ত হয়ে গেছে,আর ভইন ছোড ইবা হইল্লে জানি শান্ত অই গিয়ি,আমার ছোট বোইন কেমনে যানি নিরাই অই গেজে,আর ছোড বইনগা কেক্কান যানি ঠান্ডা অই গেছে,আমার ছোট বইন কেমন যেন শান্ত হয়া গেসে,মোর ছোডো বুইন কেমন যানি শান্ত হইয়া গ্যাছে
2258,বাবা মার আদর ভালোবাসা ছাড়া আমি বড় হয়েছি,বাবা মার আদর ভালোবাসা ছাড়া আই ডর অই গিয়ি,বাপ মার মায়া ভালোবাসা ছাড়া মুই বড় অইগেজি,বাপ-মার  আদর ভালোবাসা ছাড়া আই বড্ডা ওই গেছি,বাবা মার আদর ভালবাসা ছাড়া আমি বড় হইসি,বাপ মায়ের আদর ভালবাসা ছাড়া মুই বড় হইছি
2259,তুমি সত্যিই খুব কঠিন সময় পার করছ,তুই হাসা খুব কঠিন সময় ফার গরর,তুমি হাচাও খুব কঠিন সময় ফার করছো,তুঁই সত্যিই মেলা কডিন সময় হার কইরছো,তুমি হাচাই মেলা কঠিন সময় পার করছ,তুমি সত্যই বেমালা কঠিন সময় পার করছ
2260,বাবা হয়ে মায়ের দায়িত্ব পালন করা করা খুব কঠিন,বাবা অইয়েরে মার দায়িত্ত ফালন গরা খুব হঠিন হাম,বাফ অইয়া মাই এর দায়িত্ব পালন করা খুব কঠিন,বাপ ওই মার দায়িত্ব পালন করা মেলা কডিন,বাপ হয়া মায়ের দায়িত্ব পালন করা করা মেলা কঠিন,বাপ হইয়া মায়ের দায়িত্ব পালন করা ম্যালা কঠিন
2261,একটি শিশুকে একমাত্র তার মায়ের কোলেই মানায়,এক্কান শিশুরে একমাত্র তার মার হলত মানায়,একটা শিশুকে একমাত্র তার মাইয়ের কোলেই মানায়,ওগগা বাইচ্চারে হুদা হিগার মার কোলেই মানায়,একটা আবুরে একমাত্র হের মায়ের কোলেই মানায়,এউক্কা গেদুরে খালি হ্যার মায়ের কোলেই মানায়
2262,আমার কোলে এসে শিশুটি তার মাকে খোঁজে মনে হয়,শিশু ইবা আর হোলত আইয়েরে তার মারে খুজের ফাল্লার,আমার কোলে আইয়া শিশুটারে তার মাই রে খোজে মনে হয়,আর কোলে আই বাইচ্চাগা হিগার মারে টোগায় মনে ওয়,আমার কোলে আয়া আবুডা হের মারে খোঁজে মনে হয়,মোর কোলে আইয়া গেদুডা হ্যার মায়রে খোজে মনে হয়
2263,আমি যে মা তাই আমি আমার বাচ্চার মুখের দিকে তাকিয়ে অনেক কিছু বুঝতে পারি,আই যে মা তাই আই আর বাইচ্চার মুখর মিক্কে সাইয়েরে বহুত কিছু মুঝিত্তারি,আমি যে মাই তাইন মুই আমার বাচ্চার মুখের দিকে তাকিয়া অনেক কিছু বুঝতে পারইন,আইয়ো দেন বাইচ্চার মা এইডার লাই আই বাইচ্চার মুকে রেনি মেলা কিছু বুইঝদাম হারি,আমি যে মা তাই আমি আমার বাচ্চার  মুহের দিকে তাকায়া অনেক কিসু বুঝতাম পারি,মুই যে মা হেইতে মুই মোর গেদুর মুখের দিক চাইয়া ম্যালা কিছু বোঝতে পারি
2264,এই কঠিন বাস্তবের সাথে তোমাকে মানিয়ে নিয়ে চলতে হবে,এই কঠিন বাস্তবের ফোয়ারিত মানাই চলন ফরিব,এই কঠিন বাস্তবের লগে তোমাকে মানিয়া নিয়া চলতে অইবো,এই কডিন বাস্তবতার লগে আর মানাই চইলতে ওইবো,এই কঠিন বাস্তবের সাথে তোমারে মানায়া নিয়া চলতে হইব,এই কঠিন বাস্তবের লগে তোমারে মানাইয়া লইয়া চলতে হইবে
2265,মেয়েটি একটি ভালো চাকরি করে,মাইয়া ফোয়া ইবা ভালো চরি গরে,ফুড়িটা একটা ভালো চাকরি করে,মাইয়াগা এক্কান ভালা চাকরি করে,মাইয়াডা একটা ভালা চাকরি করে,মাইয়াডা এউক্কা ভালো চাকরি করে
2266,এই মাসে ছেলে তার পরিবার নিয়ে ঘুরতে যাওয়ার কথা,এই আমসত ফোয়া তার ফরিবার লইয়েরে ঘুরিবার যাইবার হতা,এই মাসো ফুয়া তার পরিবার নিয়া ফাকানিত যাওয়ার কথা,এই মাসে হোলার হেতের পরিবার লই ঘুইত্তে যাইবার কতা,এই  মাসে ছেড়া তার পরিবার  নিয়া ঘুরতে যাওনের কথা,এই মাসে পোলায় হ্যার পরিবার লইয়া ঘোরতে যাওয়ার কথা
2267,আমার পরিবার আজকে বিকালে তোমার পরিবারের সাথে কথা বলবে,আর ফরিবারা আজিয়া বিকালত তোয়ার ফরিবারর ফোয়ারিত ফতা হইব,আমার পরিবার আইজকে বিকালে তোমার পরিবারের লগে মাতবে,আর পরিবার আইজ্জা তোর পরিবারের লগে কতা কইবো,আমার পরিবার আইজকে বিহালে তোমার পরিবারের লগে কথা কইব,মোর পরিবার আইজ বিয়ালে তোমার পরিবারের লগে কথা কইবে
2268,আমাদের দুজনের বিয়ে হওয়ার কথা চলছে,আরা দুইজনর বিয়া অইবার হতা চলের,আমাদের দুজনের বিয়া অওয়ার মাত চলতেছে,আংগো দুইজনের বিয়া ওইবার কতা চলের,আমরার দুইজনের বিয়া হওনের কথা চলতাসে,মোগো দুইজনের বিয়া হওয়ার কথা চলতেয়াছে
2269,মেয়েটি এই ছেলেকে বিয়ে করতে রাজি হচ্ছে না,মাইয়া ফোয়া এই মরতফোয়া ইবারে বিয়া গইত্ত রাজি ন অর,ফুড়িটা এই ফুয়ারে বিয়া করতে রাজি অর না,মাইয়াগা হোলাগারে বিয়া কইরতো রাজি ওয়ের না,মাইয়াডা  এই পোলাডারে  বিয়া করতে রাজি হইতাসে না,মাইয়াডা এই পোলাডারে বিয়া করতে রাজি হইতেয়াছেনা
2270,আমার স্বামী আমাদেরকে নিয়ে রাতের বেলা ঘুরতে বের হবে,আর জামাই আরারে লইয়েরে লাতিয়া ঘুইরতে বাইর অইবদে,আমার স্বামী আমাদেরকে নিয়া রাইতর বেলা ফাকানিত বের অইবা,আর স্বামী আরে লই রাইতকা ঘুইত্তো বারিবো,আমার জামাই  আমারারে নিয়া রাইতের বেলা ঘুরতে বাইর হইব,মোর জামাই মোগো লইয়া রাইতের বেলা ঘোরতে বাইর হইবে
2271,আমার পছন্দ হয় এমন ছেলে আমার বাবা মায়ের পছন্দ হয় না,আর ফসন্দ অয় এইল্লে ফোয়া আর বাবা মায়ের ফসন্দ ন অয়,আমার ফছন্দ হয় এমন ফুয়া আমার বাফ মাইয়ের ফছন্দ হয় না,আর হছন্দ ওয় এক্কা হোলা আর বাপ মার হছন্দ ওয় নাহ,আমার পসন্দ হয় এমন ছেড়া  আমার বাপ মায়ের পসন্দ হয় না,মোর পছন্দ হয় হেরহম পোলা মোর বাপ মায়ের পছন্দ হয় না
2272,তোমার মত মানুষেরা কখনো ঠিক হবে না,তোয়ার মত মানুষরা হন সমত ঠিক ন অইব,তোমার মত মানুষেরা কখনো ঠিক হবে না,তোর মতো মাইনসেরা জীবনও ভালা ওইতো নো,তোমার মত মানুষেরা কহনো ঠিক হইব না,তোমার নাহান মানুরা কহনো ঠিক হইবে না
2273,ছেলেটি তার পরিবারের পছন্দে বিয়ে করে ফেলে,ফোয়াা ইবার তার ফরিবারর ফসন্দ মতন বিয়া গরি ফেলায়,ফুয়াটা তার ফরিবাবের পছন্দে বিয়া করি ফালাইছে,হোলাগা হিগার পরিবারের হছন্দে বিয়া করি হালাইছে,ছেড়াডা হের পরিবারের পসন্দে বিয়া কইরা ফালায়,পোলাডা হ্যার পরিবারের পছন্দে বিয়া কইররা হালায়
2274,আমার ভাই মেয়েটির সাথে গতকাল যোগাযোগ করে,আর ভাই মাইয়া ফোয়ারফোয়ারিত যোগাযগ গরে দে,আমার ভাই ফুড়িটার লগে গতকাল যোগাযোগ করে,আর ভাই কাইল্গা মাইয়াগার লগে যোগাযোগ  কইরছে,আমার ভাই  মাইয়াডার  লগে গতকাল যোগাযোগ করে,মোর ভাই মাইয়াডার লগে গ্যাছেকাইল যোগাযোগ করে
2275,ছেলে কোন ধরনের মামলা চায় না,ফোয়া হোন ধরনর মামলা ন চায়,ফুয়া কোন ধরনের মামলা চায় না,হোলাগা কোন ধরনের মামলা চায় না,ছেড়া কোন ধরনের মামলা চায় না,পোলায় কোন ধরনের মামলা চায় না
2276,সে বিবাহিত তাই মামলা করতে চাচ্ছে না,সে বিবাহিত এতেল্লাই মামলা গরিত ন সার,হে বিয়াতি তাই মামলা করতে চার না,হিগা বিবাহিত এইডার লাই কোন মামলা কইরতো চায় না,হেয় বিবাহিত তাই মামলা করতে চাইতাসে না,হ্যায় বিয়াইত্যা হেইতে মামলা করতে চাইতেয়াছে না
2277,এই বিষয়টা জানাজানি হলে মহিলাটির সংসার টিকবে না,এই বিষয়ান জানাজানি অই গেইলে মহিলা ইবার সংসার ন টিকিব,এই বিষয়টা জানাজানি অইলে বেডিনতর সংসার টিকতো না,এই বিষয় আন জানাজানি ওইলে মাইয়াগার সংসার আর টিকতো নো,এই বিষয়ডা জানাজানি হইলে বেডিডার সংসার টিকতো না,এই ব্যাপারডা জানাজানি হইলে মাতারির সংসার টেকপে না
2278,আমার বন্ধু মেয়েদের সাথে সারা রাত জেগে কথা বলে,আর ফুরা লাত জাগিয়েরে মাইয়াফোয়ার ফোয়ারিত হতা হয় দে,আমার বন্ধু ফুড়িন্তর লগে সারা হারা রাইত জাগিয়া মাত মাতইন,আর বন্ধু হারা রাইত জাগি মাইয়াগমাইয়াগো লগে কতা কয়,আমার বন্ধু ছেড়িরার লগে সারা রাইত জাইজ্ঞা কথা কয়,মোর দোস্ত মাইয়াগো লগে হারা রাইত জাইজ্ঞা কথা কয়
2279,আমার কাবিনের টাকা তোমাকে প্রতি মাসে মাসে দিতে হবে,আর হাবিনর টেয়া তোয়ার ফ্রতি মাসত মাসত দন ফরিব,আমার কাবিনের টেখা তোমাকে পতি মাসো মাসো দিতে অইবো,আর কাবিনের টেয়া তোর আরে হতি মাসে মাসে দেন লাইগবো,আমার কাবিনের টাকা তোমারে প্রতি মাসে মাসে দিতে হইব,মোর কাবিনের টাহা তোমারে পেরতেক মাসে মাসে দেতে হইবে
2280,আমার বড় ভাই সাত মাস প্রেম করে একজনকে বিয়ে করেছে,আর ভআই ডোর ইবা সাত মাস ফ্রেম গরিয়েরে একজনেরে বিয়া গইজ্জে,আমার বড় ভাই সাত মাস প্রেম করিয়া একজনকে বিয়া করছে,আর বড্ডা ভাইয়া হাত মাস প্রেম করি আরেকগা রে বিয়া কইরছে,আমার বড় ভাই সাত মাস প্রেম কইরা একজনরে বিয়া করসে,মোর বড় ভাই সাত মাস প্রেম কইররা একজনরে বিয়া করছে
2281,আমি ক্লাসের সব ছেলেদের সাথেই মিশতাম,আই ক্লাসর বেয়াক ফোয়ারিত মিশ্তাম,আমি ক্লাসের হকল ফুয়াদের সাথেই মিসতাম,আই ক্লাসের বেজ্ঞুন হোলার লগেই মিশতাম,আমি ক্লাসের বেগ ছেড়ারার  সাথেই মিশতাম,মুই কেলাসের হগল পোলাগো লগেই মেশতাম
2282,তোমার অনেক ভুল ছিল,তোয়ার বহুত ভুল আসিল,তোমার অনেক ভুল আছিল,তোয়ার অনেক ভুল আসিল,তোমার মেলা ভুল আসিল,তোমার বেমালা ভুল আল্লেহ
2283,এই তিন বছরের শিশুটির দোষ কোথায়,এই তিন বছরর শিশু ইবার দোষ হন্ডে?,এই তিন বছরের শিশুটির দোষ কোয়াই?,এই তিন বছরে বাইচ্চা ইয়ার দোষ কন্ডে?,এই তিন বছরের আবুডার দোষ কোনখানে ?,এই তিন বছরের গেদুর দোষ কোম্মে?
2284,তোমাকে বলেছিলাম বিয়েটা করে ফেলো,তোয়ারে হইয়ি বিয়া গরি ফেলো,তোমাকে কইলাম বিয়াটা করি ফালাইতা,তোওয়ারে কইসিলাম বিয়াগা করিয়েলো,তোমারে কইসিলাম বিয়াডা কইরা ফালাও,তোমারে কইছিলাম বিয়াডা কইররা হালাও
2285,শুধু তোমার ভালোর জন্য বিয়েটা করে ফেলতে বললাম,শুধু তোয়ার ভালোর লাই বিয়া ইবা গরিবেল্লাই হইলাম,শুধু তোমার ভালার লাগি বিয়াটা করিয়া ফালাইতা কইলাম,হুদা তোওয়ার ভালার লাই বিয়াগা করি লাইতো কইসিলাম,খালি তোমার ভালোর লাইজ্ঞা বিয়াডা কইরা ফালাইতে কইলাম,হুদা তোমার ভালোর লইজ্ঞা বিয়াডা কইররা হালাইতে কইলাম
2286,তোমার ভালোর জন্যই আমি তোমাকে ছেড়ে দূরে চলে আসছি,তোয়ার ভালোর লাই আই তোয়ারে ছাড়ি দুরত চলি গিয়ি,তোমার ভালার লাগি মুই তোমারে ছাড়িয়া দুরই চলিয়া আইসি,তোওয়ার ভালার লাই আই তোওইয়ারে ছাড়ি দূরে চলি আইসি,তোমার ভালোর লাইজ্ঞাই আমি তোমারে ছাইড়া দূরে চইল্লা আইসি,তোমার ভালোর লইজ্ঞাই মুই তোমারে থুইয়া দূরে চইল্লা আইছি
2287,আমি আর তুমি একসাথে নেই আমি এটা মানতে পারছি না,আই আর তুই একফোয়ারিত নাই ইয়ান আই মানিন্নোফারির,আমি আর তুমি একলগে নাই আমি এইটা মানতে ফারছি না,আই আর তুই এক লগে নাই ইয়া আই মাইনতাম হারিয়ের না,আমি আর তুমি একসাথে নাই আমি এইডা মানতে পারতাসি না,মুই আর তুমি একলগে নাই মুই হেইডা মানতে পারতেয়াছি না
