Sentence,English Translation, Labels
মুই বাংলা আ্যাকছের ভালোপাই,I love Bengali very much.,Barisal
এউগ্যা মোর পছন্দের খাওন,This is my favorite food.,Barisal
তুমি একটু রও,you wait a little,Barisal
দয়া করি এটা মোর জন্যে করেন,Please do this for me.,Rangpur
এহন বৃষ্টি হইতাছে বাইরে যাইস না,"It’s raining now, don’t go outside.",Khulna
এই কামটা খুব কষ্টকর,This work is very painful.,Narail
তুই কি কফি পছন্দ করিস,Do you like coffee?,Khulna
আজগে খুব বৃষ্টি আইবো,It’s going to rain heavily today!,Khulna
সে খুব ভালো কথা কই,He speaks very well.,Khulna
আমার সাথে এসু,Come with me.,Khulna
দয়া করি দরজাটা আটকে দে,Please close the door.,Rangpur
আরে তুমি কি চমৎকার,Hey! You are amazing!,Barisal
তোমাই স্কুলি যাও,You go to school.,Khulna
মুই কি তোমার কথা শুনবের পাইম,Can I hear you?,Rangpur
মোর জন্য একটু সহানুভূতি দেখান,Show me a little sympathy.,Narail
একল্যায় একল্যায় এংক্যা করি নুকি যায়া দাওয়াত খাওচেন,He's hiding and eating alone like this.,Rangpur
তোক দুইচোখে দেখির মন চায়ছেনা,I don’t want to see you with my own eyes.,Rangpur
একদিন মুই তোমার বাড়িত আগপাক দিয়া হাটপার ধরছুনু হায়রে দেওয়ার ঝড়ি,"One day, I went early to your house and got stuck in the storm.",Rangpur
তোর আব্বা কই গেলা,Where did your father go?,Khulna
হগলডি কির লইগ্গা যেন উল্ডাপাল্ডা হইতেছে,I know why everything seems to be upside down,Barisal
আমি তোমার লগে পরে কতা কমু,I’ll talk to you later.,Barisal
বই সবাই,Everyone’s fine.,Khulna
এত আশকারা দিসনা,Don’t give too much priority,Barisal
তুমি হগলডির সাহায্যে আউগাইয়া আও,You come forward to help everyone.,Barisal
এর স্ফটিক কিউব আকৃতির,Its crystals are cube-shaped.,Narail
তুমি খুব আস্তাভাজন,You’re very trustworthy.,Khulna
মুই তোমার কামে সন্তুষ্ট,I am grateful for your work.,Barisal
তোমার ছোলেবেলার সেরা স্মৃতি কি,What’s your best childhood memory?,Narail
হাদিস বর্ণনাকারীরা আরহো একটি উপাহে লাভবান হতে পারে,Hadith narrators can also benefit in one way.,Narail
এই জায়গাডা আ্যাকছের সুন্দার,This place is very beautiful.,Barisal
কাইলগো লইয়া আমু,I will bring it tomorrow,Barisal
কাজটি সঠিকভাবে করো,Do the work correctly.,Narail
এডা খুব বিরক্তিকর,This is very annoying.,Khulna
এই গাড়িকান টপকরি যায়,This car goes fast.,Rangpur
এহানে মানু মরে,People die here.,Barisal
আল্লাহর ওয়াস্তে থাম ব্যাডা,please calm down,Barisal
এইখান ঘাটা এত্তএখনা আসিরে নামনায়,This pond is still here; go down.,Rangpur
আস্তে আস্তে কতা ক,Speak slowly.,Rangpur
তুমি হগল সোমায় সুচিন্তাই হরো,You always think positive.,Barisal
এই জন্যে মুরুব্বীর ঘর কয়,That's why the elders say,Rangpur
তোর আবার গিছি,You’ve gone again.,Khulna
তোমার আত্নবিশ্বাসে জোর আছে,Your confidence is very strong.,Barisal
বাড়িতে কারা কারা আছে এখন,Who is home now?,Narail
এর ফলশ্রুতিতে কলা স্থাপত্য প্রযুক্তিতে ব্যাপক উন্নতি সাধিত হয়,"As a result, there was a great improvement in art and architectural technology.",Narail
বন্দরে তোক দেখনু রাসতাত,I saw you on the road near the port.,Rangpur
তোমরা কি ছবি দেইখবের চান,Do you want to see pictures?,Rangpur
এন্নে কি করতে হবে বলো,Tell me what to do now.,Narail
আমি হেরেএকটি বই কিনতে দেখেছিলাম,I saw a book I bought at a bookstore.,Narail
দয়া করি এটা আরেকবার কইবেন,Could you please say that again?,Rangpur
তোকে কইলাম না এইডা ঠিক না,I told you this isn’t right.,Narail
মুই ভালো আন্দিবের পাম,I can take care of it well.,Rangpur
ওযার মাস পোয়া আইতোত উঠিবারে নামনায়,"It’s the month of Ramadan, and I really don’t feel like waking up for sehri.",Rangpur
সঠিকভাবে কামটা করো,Do the job properly.,Narail
তুমি কি নুতান কামের লইগ্গা রেডি,Are you ready for a new job?,Barisal
চিন্তা করোচি সামনে যাওআয় নাগবে,Thinking about what will happen in the future.,Rangpur
এতদিন পর কোনটি থাকি আইনেন,Where have you come from after so long,Rangpur
তোর চোখ ভালো,Your perspective is admirable.,Rangpur
সাংকিত করি খই দিয়া খাইম,I’ll eat puffed rice (khai) served in a clay bowl.,Rangpur
হের জন্য উপহার কেনো,Buy a gift for him/her.,Narail
সবার আগে বিশ্রাম নাও,"First of all, rest.",Narail
এউগ্গা সয়ত্যই হতাশাজনক,It's really disappointing.,Barisal
কবে দ্যাহা হইবে,When will you meet?,Barisal
এটা মোর প্রিয় খাবার,This is my favorite food.,Narail
আমি নতুন একনা শিখ সং,I am learning something new.,Rangpur
সে সেইপরিমাণে হাসিখুশি মেয়ে,She is such a cheerful girl.,Narail
কাছের বন্ধুর কাছ থেকে বিশ্বাসঘাতকতার অভিজ্ঞতা বিশ্বাসঘাতকতা নিয়ে আসে,The experience of betrayal from a close friend brings betrayal.,Narail
মোর আব্বায় বিদেশ থাকে,My father is abroad.,Barisal
টিবিডা বন্ধ করো,Turn off the TV.,Khulna
মোদেরকে বললে তো মোরাও যাইতাম,"If you had told us, I would have gone too.",Narail
দয়া করে এটি আরেকবার বলবেন,Could you please say that again?,Narail
শিক্ষা সফরে গ্যাছিলো,Went on a study tour.,Narail
মুই এই কামটা করবের চাং না,I am not willing to do this.,Rangpur
তোরা বাহে খুব ভালো সাথী,You are a great colleague.,Rangpur
হেয় চেইতা গেসেহ,It’s gone like this.,Barisal
এ দরজাটা বন্ধ কর দিন,Please close the door.,Khulna
মনে হয় তুই খুব ক্লান্ত,You seem tired.,Rangpur
কলেজে পড়ালেখা করলাম,I studied in college.,Narail
তুই কি নতুন কিছু শিক্তিচি,Are you learning something new?,Khulna
সজলের বাড়ি যানো কোন গাঁয়ে,Which village is Sajal's house in?,Narail
তুমি কি কোনও নতুন প্রকল্পে কাজ করতিছো,Are you working on any new project?,Narail
তুই কি বিশেষ কিছু ভাববেলাগছিস,Are you thinking of something special?,Rangpur
তোর জন্য মোর মেলা সম্মান,I have a lot of respect for you.,Rangpur
ওকেনা আরাম নেংচোং,He/She is not comfortable.,Rangpur
মুই এহন যাইতে পারমু না,I can't go now,Barisal
হামরা গেইনো,We went.,Rangpur
বাজার থেইক্কা কই গেলি,Where did you go after coming back from the market?,Khulna
নাসিম তুই কহনো কলকাতা গেছিস,"Nasim, did you went to Kolkata.",Narail
হায় এটা কীভাবে সম্ভব হলো,Alas! How was this possible!,Narail
এমনি কমর ভাংচে,And that’s how I ended up breaking my back.,Rangpur
হেই আকাশের দিকে চাইয়ে বলল কী সুন্দর বৃষ্টি হচ্ছে,"Hey, he looked up at the sky and said, ""What a beautiful rain it is.""",Narail
তুমি কি শহরের বাইরে যেতে চাও,Do you want to go outside the city?,Narail
আজকে পিঠা বানামু সাহায্য করবি,Today we will make rice cakes; will you help?,Rangpur
হে কোলো মোর হাতের রানদন চাইট্টা পুইট্টা খায়,He licks the food from my hand again,Barisal
তোর বইডা দিয়া দে,Give me your book!,Khulna
সুজলা সুফলা ছিল বাংলাদেশ,Bangladesh was prosperous and prosperous.,Narail
ঝাল আর মিষ্টির রাজা রংপুরের লাল চা,"The king of spice and sweetness, Rangpur red tea!",Rangpur
তোর দরকার হইলে আয়,Come if you need me.,Rangpur
আজ স্কুলে অনেক মজা হুইছিল,Today school was very fun.,Khulna
মুই একনা ইন্টারভিউতে আচ্ছং,I am in an interview.,Rangpur
হেই গাছটা কাটমু কালক,I will cut that tree tomorrow.,Rangpur
হেয় কেমনে ভিম্রি দিছে দেখ,Look at how he tricked,Barisal
তোমার নাম কি বাহে,What is your name?,Rangpur
দিনে দিনে মোগো সংস্কৃতির মানুগুলান বেমালা জায়গায় ছড়াইয়া ছিডাইয়া গ্যাছে,"At the same time, the people of our culture are also scattered in different places",Barisal
ঘরের কামডা করছস,Are you doing the housework?,Khulna
একটু হাসো,Smile a little.,Narail
হেরা তিন ভাই আছেলো তয় হেগো মইধ্যে মিল আছিলো না,There were three brothers but no match among them.,Barisal
আরে এতো সোন্দর জাগা আগোত দেখোং নাই,Wow! I've never seen such a beautiful place before!,Rangpur
হে একছের ডউররা,They’re all the same kind of scoundrels,Barisal
দয়া কইরে বেশি কথা কইস নে,Please don’t talk too much.,Narail
মোরে কি হেই খবরডা পাডাইবেন,Can you send me that information?,Barisal
হামরা সবায় মিলি ছেনেমা দেকপের গেছনো,We all went to see the movie.,Rangpur
মাইয়াডা বেমালা বেদ্দপ,The girl is very naughty.,Barisal
ওহ মেলা মজা,Oh! So much fun!,Rangpur
আমার এক মিনিট টাইম দে,Give me a minute.,Khulna
আরে তুমি কি ভালো,"Hey, are you good?",Khulna
এই গাছটা মেলা বড়,This tree is very big.,Rangpur
তোর কাজের জন্য আমি কৃতজ্ঞ,I am grateful for your work.,Rangpur
এইডা আবার কিরকম দাম,How is the price like this again!,Khulna
নিজের থাহার জায়গা নাই ইমতিয়াজেগো বাড়ি মনে হরসি,What have I done,Barisal
এহন বাজারের দিকে যাওয়ায় যাবে না, won't go towards the market right now,Narail
মুই সবার ভাষা হুইনে অবাক হয়ে গেছি,I am amazed at everyone’s language.,Narail
কি সুন্দর দৃশ্য,What a beautiful sight.,Narail
তুমি এহোনো এম্মের কতা কও,You still talk about here,Barisal
কখনো হেকা বেইর হুই না,Never go outside alone.,Khulna
চহিতে হুইয়া টিভি দেখতেয়াছিলাম,I was watching TV lying on the bed,Barisal
বাহ তুই তো ভালে পাইস,Wow! You are really talented!,Rangpur
আমি দোকানের সামনে দাঁড়াই রইস,I am standing in front of the shop.,Khulna
আমার দিক এট্টু মনযোগ দিন,Pay attention to me.,Khulna
তুমার পছন্দের কীড়া কোনটি,What’s your favorite sport?,Narail
মেলায় ঘুরতে গেলাম,I went to visit the fair.,Narail
কাম শেষ হলে মোক কইস,Tell me when you're done.,Rangpur
এইডা আবার কী নিয়া আসছস,What are you bringing again?,Khulna
মুই এহোনো ইস্কুলে আছি,I am still in school.,Barisal
তোমার লগে কিছু কিনেছি,I bought something for you.,Narail
মোর নয়া বইটা মেলা মজার,My new book is very interesting.,Rangpur
হায় হায় মুই ভুলে গিয়েছিলাম,Alas! I had forgotten!,Narail
তুই স্কুলে ঠিকমতো গেছস তো,Did you go to school properly?,Khulna
মাইনশে বলবে কি,What will peoples say?,Narail
বাহ তোর গলার কথা খুবে মিষ্টি,Wow! How sweet your voice is!,Rangpur
গোস্তের লগে শুরুয়া বারাইয়া দিও,Add more gravy/sauce to the meat while cooking,Barisal
কি সুন্দার এউগ্গা একটু উপহার দ্যান,"How nice, give it a little gift.",Barisal
মোরে অস্কার দেও,give me the oscar,Barisal
তোমরা কি মাছ পছন্দ করেন,Do you like fish?,Rangpur
আমার প্রিয় রং নীল,She sings very beautifully.,Narail
তোর পিও গান গা,Sing your favorite song.,Rangpur
কোনটে কোনা হামরা কবার চাইচোল অমপুরী ভাষা,Where do we want to speak Rangpuri?,Rangpur
মুই আইজকা খুব কেলান্তে মুই আইজকা খুব হাপসি গেছুং,I am very tired today.,Rangpur
তোর কি টকি দেখতে খুব ভালো লাগে,Do you like watching movies?,Rangpur
তুই সবার পচন্দের,You are everyone's favorite.,Rangpur
হায় এটা কি করনু,Oh my! What have I done?,Rangpur
তুমি মোরে কইছিলা,you told me,Barisal
আমাগে দ্যাশে মেলা ঐতিহ্যবাহী জাগা আছে,There are many traditional places in our country.,Narail
দ্রুতবেগে হেরা বনের সীমানা অতিক্রম করে শহরে গিয়েছিল,they quickly crossed the forest border and went to the city.,Narail
ঠিকমতো কাজটা কর,Do the work properly.,Khulna
আজগে মেলা ঠান্ডা বাতাস,Today there’s a lot of cool breeze!,Khulna
খাবারডা টেস্ট কইরে দেহো,Taste the food and see.,Narail
মোগো রোংপুর মোগো অহংকার,"Our Rangpur, our pride",Barisal
আহো মোদের বাড়িতে পন্তা ভাত আছে,"Come, we have leftover rice at home.",Narail
পিঠা না খাইলে রংপুর দেখা হয় নাই,"If you don’t eat rice cakes, you haven’t truly seen Rangpur!",Rangpur
হামনের এডা হরা লাগবে,you need to do this,Barisal
কি চমতেকার ব্যপার,What a great thing!,Rangpur
ভাল করে খাইস,Eat well.,Rangpur
তুমি কি খেলাধুলোয় অংশগ্রহণ অরো,Do you take part in sports?,Narail
হগলের বউ সুন্দর মোর বউ কালা,"Everyone's  wife is beautiful, my wife is dark.",Barisal
আপনার সম্পর্কে আরো কিছু জানতে চাই,I want to know more about you.,Khulna
সেলা থাকি বাচচে আছো এলাসেনে আসিলু,"I barely escaped from there, and now you decide to show up!""",Rangpur
মুই বাংলা ভাষায় কতা কইতে ভালো পাই,I love to speak Bengali language.,Barisal
কাইলগো হুক্কুরবার,tomorrow is friday,Barisal
মোগো বার্তে অতিত আইছে,Guests are coming to our house,Barisal
ক ও কি এইডা সত্য নাকি,"What is this, is it true or not?",Narail
তাড়াতাড়ি কাজ শেষ করো,Finish work quickly.,Khulna
আমার এট্টুসকান সুযুগ দেন,Give me an opportunity.,Khulna
মোর প্রিয় অং নীল,My favorite color is blue.,Rangpur
হায় মোর খুব আগ উঠছে,"Oh, I'm angry!",Rangpur
তোমার কি কোনো সাহায্য সহায়তা লাগবে,My favorite color is blue.,Narail
কোম্মেইদ্দা আইলেন,He came from Kothsi,Barisal
ঘরডা খুব গরম লাগতাছে,The house feels very hot!,Khulna
বাপে বার্তে নাই,Father is not at home,Barisal
গাড়ির বেল্ট পরো,Wear your seat belt.,Narail
তুই কি অনেক বই পড়িস,Do you read a lot of books?,Khulna
তুমি কি আমার জন্য অপেক্ষা করতিছ,Are you waiting for me?,Khulna
আমার সাথে কওয়ার আগে চিন্তা করিও,Think before you speak to me.,Khulna
হেডা তোমার জন্যি,This is for you.,Khulna
ইস্কুলির সুমায়সূচি দেহো,Look at the school timetable.,Narail
মোক কিছু ক,Tell me something.,Rangpur
তোমারা কি কোন পুরস্কার জিতেছে,Have you or your group won any awards?,Narail
টাইম থাকতে রেডি হ,Be ready at the right time.,Barisal
তোমার হাত থাকি একনা উপহার পাং,Can I get a little gift from you?,Rangpur
তোমার জীবনধারা ক্যামন,What is your philosophy?,Barisal
আরে তুমি কি অসাধারণ,Hey! You are amazing.,Narail
একটু বিশ্রাম নিতে দাও,Let me take a little rest.,Khulna
কি গম্ভীর ব্যাপার,What a serious matter!,Narail
তোমার কি স্কুলোত বন্দু আছে,Do you have friends at school?,Rangpur
তুই একলা একলা কই যাস,Where do you go alone?,Khulna
আরে এতো তাত্তারি কেদন করি হইল,Hey! How did it happen so fast!,Rangpur
অবিশ্বাস্য এটা কি সত্যি,Unbelievable! Is this true?,Narail
মুই যামু না,i won't go,Barisal
তোমার পছন্দের খেলা কোনডা,What is your favorite sport?,Barisal
বইটি এখানে রাখো,Keep the book here.,Narail
তোর জন্ন কিছু কেনছোং,I bought something for you.,Rangpur
ওয় খুউব ভাল কথা কবার পায়,He speaks very well.,Rangpur
তুই কোন কামডা করবি,Which work will you do?,Khulna
ব্যাংক এতে হিসাব দেখলাম,I checked the account in the bank.,Narail
আজকে বাজারে মেল্লা ভিড় ছিলো,There was a huge crowd at the market today.,Narail
পানিডা এক্কেরে ঠান্ডা হইয়া গেছে,The water has become very cold.,Khulna
টিবি বন্দ কর,Turn off the television.,Rangpur
মুই রোংপুইর্রা,I am from Rangpur,Barisal
খাবার খাইছো রাতে,Did you eat at night?,Narail
তুই কি নতুন রান্না শিকতি ইচ্ছুক,Do you want to learn new cooking?,Khulna
আর কোতকুন লাগবে,How long will it take?,Barisal
আমাগো তালগাছের ফল এক্কেরে মিষ্টি,The fruits of our palm tree are very sweet!,Khulna
একটু শান্ত হইয়া,Calm down a bit.,Khulna
তুই কি করিবার লাগছিস,What are you doing?,Rangpur
দয়া হইর্রা এউগ্গা আবার কইবেন,Please say it again?,Barisal
গরুটারে এক্কেরে খাইতে দিতাছস না,You’re not feeding the cow properly!,Khulna
তোমাক দেখপের পেয়া খুশি হনু,Nice to see you.,Rangpur
মোর মবাইল টা আনি দে ত,Bring me my phone.,Rangpur
মোর বই পড়তে ভাল্লাগে,I love to read books.,Barisal
মিচছানা আগত আনু,I came a little earlier.,Rangpur
এখানে দাঁড়াস,Stand here.,Khulna
ওর লগে লগে সব সময় থাকবে,I will always be with him.,Narail
তোমার প্রেত্যেকটা কতা মোরে ভরসা দ্যায়,Your every word inspires me.,Barisal
আমাকে লজ্জা লাগে না,I’m not ashamed.,Khulna
এইহানে কেউ আসে না,No one comes here.,Narail
তোরা কহন আসবি,You will come.,Narail
এট্টু সাবধান হও,Be a little careful.,Khulna
তুই কি নেয়া কোনো শিখচিস,Have you learned anything new?,Rangpur
আমাকে তুমি দেখতে দিয়ো না,Don't let me see you.,Narail
সোঠিক বাইলে কামডা হরো,Do the right thing.,Barisal
পরিবারে যোগাযোগ করলাম,I contacted the family.,Narail
তোমার কথাগুলো সব সময় উপকারী,Your words are always useful.,Khulna
মুই চা পছন্দ করোম,I like tea.,Rangpur
তুমি কি সফরে যাওয়ার পাইন্নে কোনো প্লান হরছো,Are you planning to go on a trip?,Barisal
আম্মের মোন খারাপ হইর্রেন না,Don't get upset,Barisal
মুই তোর উপকারত মেলা খুশি,I am grateful for your help.,Rangpur
ভাই কোয়ানে যাও,"Brother, where are you going?",Narail
রুমি রানাকে দেখতে আইছিলো,Rumi came to see Rana.,Narail
আইচকে বিয়ালব্যালা বেরো,Go out in the afternoon today.,Narail
তোমারে না মইর্রা ভাত খামু না,I will not eat rice without killing you,Barisal
এহন বেশিরভাগ মানুষ ঢাকায় গিয়ে রংপুর এর ভাষায় বলতে পারে নাহ,"Now, most people can’t speak Rangpuri properly after going to Dhaka.",Narail
আসপার লাগছোং,I am feeling tired!,Rangpur
তোর হাতে কাম নাই নাকি,Don’t you have work?,Khulna
তুমি কি সফরে যায়ার ফরিকল্পনা করতিছো,Are you planning to go on a trip?,Narail
কি আজব মানুষ,What a strange man!,Rangpur
মুই বই পড়োং,I read books.,Rangpur
আমাইগে বাড়ি লালমনিরহাটে,Our home is in Lalmonirhat.,Khulna
সবাই সব কিছু বলেই তো ফেলাইসে,You’ve already said everything.,Khulna
তোমা কটে যান,Where are you going?,Rangpur
মুই কি তোমার সাহাইজ্জ নিবার পাং,Can I get your help?,Rangpur
