Sentence,English Translation, Labels
হ মোর একটা পালা কুত্তা আছে,"Yes, I have a dog.",Rangpur
জবরদস্তি করলে কাজ নাই,Forcing won’t get the work done!,Rangpur
ভ্রমণে সাহস বেড়ে ছিলো,Courage grew from traveling.,Narail
আশ্চর্য এমনও হয়,Amazing! That happens!,Narail
এলা ফির ভাত চোরের নাগে,Now I have to cook rice again.,Rangpur
হে আ্যাকছের হাসুইন্না মাইয়া,She is a very cheerful girl.,Barisal
আরে এতো তাত্তারি করলু,Hey! You did it so fast!,Rangpur
একনা সাবধান হবার কন,Please be a little careful.,Rangpur
আয় খুব ভালো ছেলে,He is a very good boy.,Rangpur
কাইলগো ফোন হরমু,Will call tomorrow.,Barisal
তুই কি ভাইরত বেড়বার যাইশ,Are you going out for a walk?,Rangpur
চুপ করি থাকতো ওমা কি কয় কউক,"Stay quiet, let others say something.",Rangpur
আমনে মোর লগে এমনে কথা কইতে পারেন না,You can’t talk to me like that.,Barisal
তার ছোটোকোনা উয়ার বাপকে কইল বা মোর পইসা কড়ির ভাগ মোক দেও,"The younger one told his father, “Give me my share of the money.”",Rangpur
আমার কাজে কেউ সাহায্য করিস নে,No one helps me in my work.,Khulna
চিনি দিয়া চা বানাও কড়া লাগবো,Make tea with sugar; it will taste strong.,Rangpur
তুমার ব্যবহারে অনেক কষ্ট পাই,Your behavior hurts me a lot.,Khulna
ভিডিওডা দ্যাহো,Watch the video.,Barisal
মোবাইল টা চাজোজ দে,Charge the mobile.,Rangpur
মোক এলকায় যাবার নামনায় ওত্তী,I don’t really feel like going right now.,Rangpur
মুই ঢাকা শহরোত থাকোম,I live in Dhaka city.,Rangpur
তুই কি কোনো নতুন পোকোল্পের কাজ করবেলাগছিশ,Are you working on any new projects?,Rangpur
গরুডারে খাওয়াইয়া দে ভুখা আছে,"Feed the cow, it’s hungry.",Khulna
বইটা কার কাছ থেকে নিয়ে আছ,From whom did you get the book?,Khulna
লগালগ আয়ো,come back soon,Barisal
তুমি ক্লাসে সোজাসুজি বাইলে অংশগ্রহন হরবা,Do you participate actively in class?,Barisal
সবগুলি রাতে ভাত খাইছি,I ate rice every night,Khulna
এইজায়গায় আমার জন্যি দেরি করো,Delay here for me.,Khulna
মুই ঘন্টাখানেক পরেই আসিম,I will come in about an hour.,Rangpur
সে অনেক ভালো মনের মানুষ,He is a very kind-hearted person.,Narail
মুই কিছু না কই,I don't say anything,Barisal
মোরে আবার জানাবেন,Will you let me know again?,Narail
তোমরা কোনটে থাকেন,Where do you live?,Rangpur
মোরে ছেড়ে চলে গেলে,you left me!,Narail
এহন রাতে যাইলে বিপদ হইতে পারে,Going out at night could be dangerous!,Khulna
মোক একনা সাহায্য করেন,Please help me.,Rangpur
আপনার প্রবৃত্তিকে বিশ্বাস করুন যুক্তিও শুনুন,Trust your instincts and listen to reason.,Narail
এই গানডা আমার প্রিয়,This song is my favorite.,Khulna
ঠান্ডা পানি নি এসু,Bring some cold water.,Khulna
মোর হাটটা ধরেন,Catch my market.,Barisal
এটে অ্যাটে ভালকরি দাড়াও,Stand here carefully.,Rangpur
তোর কতা সোকসময় মজা নাগে,Your words are always funny.,Rangpur
আমার সবাই সিনেমা দেখতি গিছিলাম,All of us went to watch a movie.,Narail
আরে বাবা ইস্যারে কি হইছে,Oh father! What happened today?,Rangpur
মোগো বার্তে আইজগো গছি মাছ রান্না হরছে,"At our house today, the guys are cooking fish",Barisal
গেদুর নাম কি মনুর নাম কি তোমার নাম কি,what is your name,Barisal
ওইডা আমার জিনিস ধরিস না,"That’s my thing, don’t touch!",Khulna
এইলে কতা শুনবের পায়া তোর বাপ কাড়াইল দি ডাংগে তোর হাতের কল্কুনে ফাটে দেছে,Then I heard that your father got angry and hit your hand hard.,Rangpur
জায়গা কোনাত মেলা মানুষ আইসে,This place is very popular.,Rangpur
মুই দোহানে দাঁড়ায়ে আছি,I am standing at the shop,Narail
গেমিং মাউস কিনছিলাম,I was buying a gaming mouse.,Narail
এখনা সাবধান হ,Be a little careful.,Rangpur
এউগ্গা আ্যাকছের বিরক্তিকর,It's very annoying.,Barisal
এলা কাম সুরু কর,Start working now.,Rangpur
তুই ক কি করা লাগবে,"You tell me, what should I do?",Rangpur
এই ছবিডা আপনার ফোনে পাঠাতি পারেন,You can send this picture on your phone.,Khulna
তোমরা আবার ঢাহায় থাহো,You stay in Dhaka again,Barisal
এই গানকোনা মোর পছন্দের পিও,This song is my favorite.,Rangpur
আমি কি আর বলবো রে,What else will I say?,Khulna
তুমি কি এমন কিছু হুনেছো যা অদ্ভুত,Have you heard something strange?,Narail
আর দ্যাশোতও আকাল পোইল,It was premature in my country too.,Rangpur
আমার এক কাপ চা দে দিন,Give me a cup of tea.,Khulna
মইটা নিয়ে আস ধান শুকাবো,Bring the bamboo mat; we will dry the rice.,Rangpur
ওরাম ঘাপ মেরে পুড়ি রাস কে,Why do you keep scheming like that,Khulna
তোরা কোই গেলি কাইলকে,"Where did you go, tomorrow",Narail
আমি তোমার জন্য গামলায় ভাত তুলে রাখছি,I kept rice for you in the bowl.,Khulna
হামার রংপুরের ভাষায় কথা কমো সরম কিসের,"In our Rangpur dialect, what else would I say—just be honest",Rangpur
মোর সাথে একনা আয়,Come with me for a moment.,Rangpur
দোয়া টা খিব আন্ধার কচ্ছে,The sky looks very dark.,Rangpur
কোটে দেখা হবে,Where will we meet?,Rangpur
আমি রংপুরের ভাষা জানিনে,I don’t know Rangpur dialect.,Khulna
ডোগাত করি দুধ থুয়া দিবু মোর বাদে তোমার বাড়ির অস্ট্রেলিয়ান গাইকোনার,Keep the milk in a bowl for me — not for your Australian cow at home,Rangpur
তুমি কি বিশেষ কিছু ভাবছো,Are you thinking about something special?,Narail
মুই তোমার সাথে যাবার চাম,I want to go with you.,Rangpur
মোরে সাহায্য হরতে যাইয়া আম্মের আবার অসুবিধা হইবে,Would it be difficult for you to help me?,Barisal
কোথায় গেলি,Where did you go?,Khulna
কাজটা সহজ ওমা কইছিলো,"The task was easy, she said.",Rangpur
ধন্যি ছেলে হলে তুমি,You are a blessed boy!,Narail
তুমি কি ক্লাসে সক্রিয়ভাবে অংশগ্রহণ করো,Do you actively participate in class?,Narail
এউগ্গা এউক্কা ভালো সোমায় কাটানোর সুযুগ,It's a chance to have a good time.,Barisal
ফির ক,Say it again.,Rangpur
কিছু সোমায়ের লইগ্যা রেস্ট ন্যাও,Rest for a while.,Barisal
সময় হলে খেয়ে নিস,Eat when you’re ready.,Khulna
এটা তুমি নিজের জন্য করো,You do this for yourself.,Narail
সুমন্ত একলা বসে আছে,Sumanth is sitting alone.,Narail
তোমার প্রিয় ছুটি কোনডা,What is your favorite holiday?,Barisal
আমাগো বাড়িতে কেউ আয় নায়,No one comes to our house.,Barisal
এট্টু অল্প করলি হবে কি বলেন,"make it a little less / smaller, what do you think?",Khulna
তুমি কি ভোমণ করতি ভালোবাসো,Do you love to travel?,Narail
দয়া করি এটে অ্যাটে খাড়াও,Please stand here.,Rangpur
তুই আইলির কবে,When did you come?,Khulna
মোর জন্যে এটা ঠিক নোমায়,This is not right for me.,Rangpur
মুই এউক্কা ইন্টারবুতে আছি,I'm in an interview.,Barisal
তোমারে তো অস্কার দেওন লাগবে,You deserve an Oscar,Barisal
সবায় তোর উপরত নির্ভর করবের পারে,Everyone can count on you.,Rangpur
মুই কিছু কইতে হারমু না,I can't say anything,Barisal
যন্ত্র বানাইতে অনুপান লাগবে,You’ll need fuel to make the machine.,Barisal
আমাদের বাড়িতে মেহমান আসতে,Guests often come to our house.,Khulna
মুই আজকে মেলা টায়ার্ড,I am tired today.,Rangpur
মোর প্রিয় রোং নীল,My favorite color is blue.,Barisal
অহন কি রান্না হলো দুপুরে,What did you cook for lunch?,Narail
ঘরডা ভিজা হইয়া গেছে,The house has become wet.,Khulna
গরমোত পোন্তা খাবার নাগে,You need to eat panta during the hot weather,Rangpur
তুই কোয়ান্নে আইছিস,Where did you come from?,Narail
ঘরডা দেইখা মনডা ভালা হইয়া যায়,Looking at the house feels so peaceful!,Khulna
বার্তে আইজগো মেহমান আইবে,Guest will come home today.,Barisal
চইল্যা আবি,Why are you acting like this just sitting around,Barisal
টানাটানি লাগতাছে সংসারে,There is tension in the household!,Rangpur
বাজারে পানি কিনতে যেয়ে ম্যালা সময় লেগেছিল,It took a long time to go to the market to buy water.,Narail
এক চোপাড়ে কানসা ফাডাইয়া হালামু,I will crack your ears with one slap,Barisal
অনলাইনে আসক্ত ছিলো,Was addicted to the internet,Narail
তোমরা খুব ভালো গান কন,You sing very well.,Rangpur
জোনাকি জ্বলতাছে রাতে,The firefly is glowing at night!,Rangpur
মুই অমপুর যাবান নং,I will not go to Rangpur.,Rangpur
মুই ছবি দেখবার চাম না,I don’t want to see pictures.,Rangpur
তোমার খাডা খাডনির ফল চমৎকার,The results of your hard work are amazing.,Barisal
এটি কোনা হামরা হামরায় তো,"Come on, it's just us!",Rangpur
গরোম পানি লইয়া আও,Bring warm water.,Barisal
তুগি এই জায়গায় আকাশ কিরাম,What's the sky like over there,Khulna
আজকে মুই খুব ক্লান্ত,I am tired today.,Rangpur
তোর চেষ্টা প্রশংসনীয়,Your efforts are commendable.,Rangpur
ইরতাজউদ্দিন সাহেব লক্ষ করলেন তাঁর ক্ষিদে লাগছে,Irtajuddin Sahib noticed that he was feeling hungry.,Narail
আমি ভালো বুঝেছিলাম,I understood well.,Narail
দেইখ্যা চক্কু গ্যালে,He got stunned after seeing,Barisal
আপনার অভিজ্ঞতা শেয়ার করবেন,Will you share your experience?,Narail
ফুলকুনার কি ঢক,This flower is very beautiful.,Rangpur
খেয়াল রাইক্কো,take care,Barisal
তোমরা কি খ্যালাদুলে পছন্দ করেন,Do you like playing outside?,Rangpur
তুই আইজগে ভালো খাইছস,Did you eat well today?,Khulna
সে আমাকে সব সুমায় প্রেরণা দেই,He always inspires me.,Khulna
অয় খুব সাহসী,You are really brave.,Rangpur
তুমি হগলের লইগ্যা প্রেরনা,You are an example for all.,Barisal
এই পরিস্থিতি আমি মেনি নীতি পারতি নে,I can’t accept this situation.,Khulna
তুই কি আমারে ভুইলা গেছস,Did you forget me?,Khulna
আমি কি আপনার কিছু জানতি পারি,Can I know something from you,Khulna
তোমরা কি নয়া কিছু শেখার ট্রাই করতেছেন,Are you trying to learn something new?,Rangpur
তোমার প্রিয় গানডা গাও,Sing your favorite song.,Barisal
মোর বাদে কি আনছিস,Did you bring anything besides me?,Rangpur
চারিদিকে আন্ধার হয়ে আসছে,It's getting dark all around.,Narail
আমার ফোনটা আইয়না দাও,bring me your phone,Narail
তোর কি নাগিবে,Will you need it?,Rangpur
তুই কি শহরের বাইরত যাবার যাইশ,Do you want to go out of town?,Rangpur
হাঁচা এটা কেদন করি হইল,Really! It's possible!,Rangpur
হেতো অনেক ভালো টিচার,He is a very good teacher.,Barisal
মোরে এহানে খাড়াইতে কইলে,Ask me to stand here.,Barisal
তোমাকে কি কইছে ও,What did he say to you?,Narail
অমপুরী ভাষাত কি এলা হামাক পাশ নম্বর দেওয়া যায়,Can we now give our passing marks in Rangpuri language?,Rangpur
তোর পড়ার জাগা পরিষ্কার কর,Clean your study space.,Rangpur
তুমি খুবই সৃষ্টিশীল,You’re very creative.,Khulna
ভাত খাইয়া যান,Go eat rice,Barisal
হামা একসাথে খেলামো,We will play together.,Rangpur
একটুখানি পানি দেবেন,Give me some water?,Barisal
বাইরে অনেক পানি পরতাসে,It’s raining a lot outside.,Narail
তুই কি পেরায় জিমত যাইশ,Do you often go to the gym?,Rangpur
এউক্কা মাইনসের দুগ্গা পোয়া আছেলে,A man had two sons,Barisal
এইডা কোন কাম হইলো,What kind of action is this,Khulna
তুমি কি নতুন কাজের জন্যি তৈরি,Are you ready for a new job?,Khulna
আরে এত দ্রুত তাড়াতাড়ি কেম্মা হলো,Oh! It happened so quickly!,Narail
ধীরে ধীরে আস্তে আস্তে কথা বলো,Speak slowly/slowly.,Narail
এই ক্যাবল আইছি,I came a little earlier,Barisal
তোমরা কি বিদেশ যাবার চান,Do you want to go abroad?,Rangpur
তুই কামডা ঠিকমতো করস নাই,You didn’t do the work properly.,Khulna
মাগো গরমডা এক্কেরে কষ্টকর,Oh mother! The heat is unbearable!,Khulna
আপনার সাথে এট্টু কথা কব,I want to talk with you a bit.,Khulna
আমাগো গ্রামের রাস্তা খুব সুন্দর,Our village road is very beautiful!,Khulna
ওয় খুব ভাল মানষি,He/She is a very good person.,Rangpur
কটে গেচলু,Where did you go?,Rangpur
বাড়ির কাজকডা শেষ করো,Finish housework.,Khulna
ওহ মোর চোহের ভুল,Oh! My eyes are wrong!,Barisal
মোর মেলা খারাপ লাগছে,I feel bad.,Barisal
আইজগো মোর কোনো মুড নাই,I'm in no mood today.,Barisal
রোং লাগছে এহন,Colors look good now,Barisal
অ্যাহা তুই দি কসাই হায় তোরে ডাক্তার কয় কেডা,"Ah, you are sick, did the doctor check you?",Barisal
মোর মা খুব ভাল,My mother is very caring.,Rangpur
তোমার কি কোন শখ আছে,Do you have any hobbies?,Rangpur
তোমরা খালি হামাক কেনে কন,Why don't you just tell me?,Rangpur
তুমি কি ভ্রমণে যাওয়ার লইগ্যা রেডি,Are you ready to go on a trip?,Barisal
মোক সাহায্য করার জন্যে তোমাক ধন্যবাদ,Thank you for helping me.,Rangpur
মোনে হইর্রো না ভুইল্লা গেছি,Don't think I forgot.,Barisal
আমডা কেডা খাই্লে,Who ate the mango?,Barisal
মোর জন্যে কিছু ফল নিয়া আসপেন,Will you bring me some fruit?,Rangpur
জীবনে সুবিধা চাচিছলাম,I wanted convenience in life.,Narail
কাল মাঠে খেলা দেখতে যাবে কিডা কিডা,Who all will go to watch the game at the field tomorrow?,Narail
তুই মোডা অইয়া গেছো,You’ve gained weight,Barisal
তুমি কি এই কোয়শ্চেনের উত্তার জানো,Do you know the answer to this question?,Barisal
মোর রুমটা খুব সুন্দর,My room is very beautiful.,Rangpur
সবাকে সনমান করবু,You respect everyone.,Rangpur
কি অদ্ভুত ব্যাপার,What a strange matter!,Narail
আম্মের লগে একটু কতা কমু,Shall I talk to you?,Barisal
মুরুব্বীরা কয় ছেলে পেলেক বেশি লেখাপড়া করা ভালো নয়,Elders say that it’s not good for boys to study too much.,Narail
তুই কি আগ করছিস,Are you angry?,Rangpur
বৃষ্টি হইলে আমি বাইরে যামু না,"If it rains, I won’t go outside.",Khulna
এলা অ্যালা দৌড়াও,Run now.,Rangpur
ধারাবাহিক প্রচেষ্টা দীর্ঘস্থায়ী ফলাফল দেয়,Consistent effort yields lasting results.,Narail
অন্যদের ক্ষমা করতে সক্ষম হওয়া অভ্যন্তরীণ শান্তি নিয়ে আসে,Being able to forgive others brings inner peace.,Narail
তোমার পছন্দের গান কি,What’s your favorite song?,Narail
কিচ্ছু ভাল নাগেছেনা,Nothing has gone well.,Rangpur
পণ্যটি নিখুঁত অবস্থায় এসেছে মোর সমস্ত চাহিদা পূরণ করেছে,The product arrived in perfect condition and met all my needs.,Narail
তুই কয় অক্ত আসিস,What time did you arrive?,Narail
কাইলকে নিয়ে আইবো,I will bring it tomorrow,Narail
মেলা সমস্যায় আছি,I’m in lots of trouble.,Barisal
বাজারডা পুরা গরম,The market is burning hot!,Khulna
তুইতো কচ্ছলু,You said it yourself.,Rangpur
মোরে কওয়ার আগে চিন্তা হইর্রো,Think before you tell me.,Barisal
মুই হাসি রেখো,Keep smiling.,Khulna
এইহানে এসে বসো,Come and sit here.,Narail
ওয়াই খুব ভালা একনা শোংরা,He is a very caring friend.,Rangpur
সে খুবই দায়িত্বশীলভাবে হের কামটি করেছিল,He did his job very responsibly.,Narail
আমি কিন্তু রংপুরে যাবো না,But I won’t go to Rangpur.,Khulna
হেয় উইঠ্যা খারাইছে না,It’s not ruined while standing.,Barisal
আরে মুই তো অবাক হয়ে গেছি,Oh! I am really amazed!,Narail
ভাইয়া কোয়ানে গেলে,where did you brother go,Narail
তুমি কি ফ্রায়ই জিমে যাও,Do you often go to the gym?,Narail
ডেন্টিস্ট তাদের রোগীর দাঁতের নিয়মিত চেক আপ করেন,Dentists perform regular check-ups on their patients' teeth.,Narail
একনা খোলাখুলি আও করবের পাই,Can we have a little frank discussion?,Rangpur
মোক এক মিনিট সময় দে,Give me a minute.,Rangpur
এটে গাড়ি থোয়া যাবে,Is it possible to park a car here,Rangpur
তোর কোনো সাহায্য নাগবে,Do you need any help?,Rangpur
টপ করি আইসেক,Come quickly.,Rangpur
তুই একটু হাস মনডা ভালো হইবো,"Smile a little, it will cheer me up.",Khulna
জীবনে টাকা না থাকিলে কোনো দাম নাই,"Without money in life, there is no value.",Rangpur
চেক রশিদ প্রদান করলেন,Check/receipt issued,Narail
বন্ধুগো লগে মজনা মিলাইছো,Have fun with friends.,Barisal
সালুন নাও,Have some curry.,Barisal
আসিয়ানে আমার বাড়ি,"Come to my home, please.",Khulna
তোরা আইসস কই,Where are you all going?,Khulna
মুই বাংলা ভাষাত কথা কইতে ভালবাসোং,I love speaking in Bengali.,Rangpur
আমাদের এইখানে কবে আইবে তোমরা,When will you come to our place?,Narail
একনা শান্ত হয়া যান,Calm down a little.,Rangpur
তোমরা যা বলবা তাই শুনবো,I’ll just listen to what you say.,Khulna
কামের উপরে মোনোযোগ দ্যাও,Focus on work.,Barisal
কি অসাধারণ সিনারি,What a wonderful sight!,Barisal
সমুদ্র পাড়ি দিয়াছিলো,Crossed the sea.,Narail
আমার গতরে আজ অনেক ঠান্ডা লাগছে,I feel very cold today.,Narail
আমি হের দিকে এগিয়ে গেলাম,I walked towards the him,Narail
তুই হগলডিরে জিগাইয়া দ্যাখ,Ask everyone,Barisal
এই স্থানের প্রাকৃতিক সৌন্দর্য হেরে ছোটবেলাতেই বিমোহিত করেছে,The natural beauty of this place captivated me since childhood.,Narail
মোক একখান চিটি দিছলু,You gave me a letter.,Rangpur
রংপুরের ভাষাই মোর মাতৃভাষা,Rangpuri is my mother tongue.,Narail
ঠান্ডা পানি নিয়ে আসো,Bring cold water.,Narail
আম্মের সোম্পার্কে আরও জানতে মোল্লায়,Want to know more about you.,Barisal
ততক্ষন সুপারীটা চাবান,"Until then, chew the betel nut.",Narail
বৃষ্টি আসতাছে ঘরমুই যাও,"It’s raining, go home!",Rangpur
সৌন্দর্য খুঁজতে যাচ্ছিলাম,I was going to look for beauty.,Narail
তোমরা কি মেলা লম্বা আস্তা লাইক করেন,Do you like long scarves?,Rangpur
আমি কিন্তু কথা বলতে পারি,But I can talk.,Khulna
আম্মেরে দেইক্কা খুশি হইলাম,Glad to see you.,Barisal
তুমি সবকিছু সহজে করতি পারো না,You can’t do everything easily.,Khulna
