Sentence,English Translation, Labels
মোর একটা নতুন কাম শুরু হয়েছে,I’ve started a new job.,Narail
আমি ইতিহাস পড়তে গ্যাছিলাম,.I was going to study history.,Narail
মুই আমু না,I won’t come.,Barisal
আমাকে আপনার অভিজ্ঞতা বল,Tell me your experience.,Khulna
তুই কি এই গান সুনিচি,Have you heard this song?,Khulna
ডাং খাবার না চাইস,are you looking to get beaten or what,Rangpur
মোর দিকে একটু মনোযোগ দিন,Pay some attention to me.,Narail
হায় কতো বড় ভুল করলাম,Oh! What a big mistake I made!,Narail
মোরে বোলাইবেন না,Don’t call me.,Barisal
তুই যে ভালো গান গাস,You sing well.,Khulna
তুমি সবসুমাই পেঁচাই করিস,You always twist things.,Khulna
মুই বাড়ী যাইম,I’m going home.,Rangpur
হে হ্যার লক্ষ্য অর্জনের লইগ্যা কঠোর পরিশ্রম হরছে,He is working hard to achieve his goals.,Barisal
ওয় খুব ভালে নাচে,He/She dances very well.,Rangpur
এই গানডা আমার ফিয়ো,This song is my favorite.,Narail
বৃষ্টির পানিতে সব রাস্তা ডুইবা গেছে,All the roads are flooded with rainwater!,Khulna
আইজকে একটু বেশি ঠান্ডা লাগছে,I feel a little cold.,Narail
সে এসেছে গাং থেকে পানি নিতে,He has come to get water from the river,Narail
তাড়াতাড়ি আয়,Hurry up.,Khulna
তোমাক তো বাহে অস্কার দিবার নাগবে,You should be given an Oscar.,Rangpur
গবেষণা প্রকাশ করলাম,I published the research.,Narail
অয় প্রতিদিন বিয়ানে দৌড়ায়,He runs every morning.,Rangpur
তুই কি ব্যস্ত আছিস,Are you busy?,Rangpur
চেয়ার কোনা নিয়া আয়,Bring the chair.,Rangpur
এটা ভুলি যা,Forget it.,Rangpur
বিলাসপুর জেলে দিন অনশন করেছিলো,He went on a hunger strike for days in Bilaspur jail.,Narail
সে টেকনিশিয়ান আছিলো,He was a technician.,Narail
প্রতিদিন শুধু পানি হইতিছে মোদের এইহানে,Every day water is rising there,Narail
তোমার কি পছন্দের টিভি শো ভাল্লাগে,Do you have a favorite television show?,Barisal
রোংপুইর্রা ভাষায় কি মোগো পাশ নোম্বার দেওন যায়,Can we give our pass number in Rangpuri language now?,Barisal
কাম শ্যাষ হইলে মোরে কইও,Tell me when it's done.,Barisal
সাথে সাথে হামার সংস্কৃতির মানষি গুলাও বিভিন্ন জাগাত ছড়ি ছিটি গেইছে,"At the same time, the people of our culture have also scattered to different places.",Rangpur
সবাই ঠিকঠাক শোনো,"Everyone, listen carefully.",Narail
তুমি কি এমন কিছু হোনছো যা উদ্ভট,Have you heard anything strange?,Barisal
তোমার পড়ার জায়গা পরিষ্কার করো,Clean your study area.,Narail
শফিক স্যার মোরে এটা পড়তে বলেছে,Shafiq sir asked me to read this.,Narail
এটটুহানি ঘুমাইয়া লও,Sleep a little.,Barisal
তুই সত্যিই অনুপ্রেরণাদায়ক,You are truly inspiring.,Rangpur
আইজগো কি দিন হ্যাকি জানো,Do you know what day it is today?,Barisal
আল্লার ওয়াস্তে চোপাডা বন্ধ রাখ,Please don't talk too much.,Barisal
ব্যাডাডা মোরে দুই চোহে দ্যাখতে হারে না,The man cannot see me with both eyes,Barisal
একটু মোরে শোনেন,Listen to me for a bit.,Narail
মুই রোংপুইর্রা ভাষা জানি না,I don't know the language of Rangpur,Barisal
এলা ফির নতুন করি অংপুরিয়া ভাষা শেকপেন নাকি,Are you going to learn the Rangpur language again?,Rangpur
হে এহন কি হরতে আছে,What is he doing now?,Barisal
তুমি কি নতুন কিছু শিখতি চাও,Do you want to learn something new?,Narail
এটে বইস,Sit here.,Rangpur
তুই কি চা পচন্দ করিশ,Do you like tea?,Rangpur
মুই তোমার বন্ধু হইতে চাই,i want to be your friend,Barisal
হ মুই মাছ পছন্দ করোম,"Yes, I like fish.",Rangpur
মোরে লইয়া লয়েন,Take me with you.,Barisal
কাইলক কি পরবাস যাওয়ার,Are you going abroad tomorrow?,Rangpur
কিছু লোক দেখি ক্ষেতে যাচেছ,I saw some people going to the fields.,Narail
দয়া করে একটু মনোযোগ দাও,Please pay attention.,Narail
তোমার ঘরে কি গাড়ি আছে নাকি,Do you have a car at home?,Rangpur
হায় এডা কি হরলাম,Alas! What did it do!,Barisal
দয়া করি একনা সাহাইজ্জ করেন,Please help me.,Rangpur
তোমার চিন্তাচেতনা সেই,Your thinking is amazing.,Barisal
পরকাল নিয়ে ভাবছিলাম,I was thinking about the afterlife.,Narail
তুই কি নতুন কিচু চেষ্টা করবের চাইশ,Do you want to try something new?,Rangpur
এলা কি তোর কোনো হিল্লে হইছে,Has anything happened to you?,Rangpur
তোরা আছ একটু বয়,You are a bit grown up now.,Khulna
বাইরে বাতাসডা বইতাছে দরজা বন্ধ কর,"The wind is blowing outside, close the door.",Khulna
হাট থাকি ত্যাল মইচ ওসুন পিয়াইচ আনেন,"Get oil, chili, garlic, onion from the market.",Rangpur
মুই ফিররা আইলাম,I came back.,Barisal
ইস্যারে দেখলে হৈরানি লাগে,Seeing today is surprising!,Rangpur
তুমি আ্যাকছের যত্নবান মানু,You are a very caring person.,Barisal
আম্মের সহায়তা লাগবে,You need help.,Barisal
এই তথ্যভাণ্ডার আমাকে অবাক করে,This database amazes me.,Narail
ফুলের মালা দেলে দামি দেইক্কা ফুলের মালা দিমু,"Even if I give flower garland, I will give expensive flower garland",Barisal
ওয় প্রতিদিন সকালে করি হাঁটে,He walks every morning.,Rangpur
তুমি কি বিশেষ কিছু ভাবতিছো,Are you thinking about something special?,Narail
তমার উপদেশ হামার জন্য মূল্যবান,Your advice is valuable to me.,Rangpur
কেমনে কাম করতাম,How did I work?,Barisal
তুমি কি খেলতি চাও,Do you want to play?,Khulna
তোমরা কি ছবি দেখতে পছন্দ করেন,Do you like looking at pictures?,Rangpur
আজি মেলা কাজ আছে,there are lots of work today,Rangpur
হাগে মাই তুই কেমন আছিস,how are you?,Rangpur
তোমার কতা হগল সোমায় সয়ত্য,Your words are always true.,Barisal
চন্দ্রবিমান ছিল ভারতের,.The moon mission was India's.,Narail
জানডা ঘরে রাইখখ্যা,Keep the things in the room.,Barisal
মুই এই প্রস্তাবটা গ্রহন করির চাং,I am willing to accept this proposal.,Rangpur
একদিন শুনছিলাম,One day I heard.,Khulna
আহ শান্তি,Ah! Peace!,Rangpur
সবুর করেক সময় পাল্টি যাবে,"Be patient, time will change.",Rangpur
আমার শৈশবের স্মৃতি এর সাথে জড়িত মানুষগুলোর কথাও মনে পড়ে গেল,I also remembered the people involved in my childhood memories.,Narail
সে মেলা ভালো কথা কয়,He speaks very nicely.,Narail
মোগো বাড়ি বড়,Our house is big.,Barisal
তোরে আর বিশ্বাস করা যায় না,I can’t trust you anymore!,Khulna
তোমার কতা হগল সোমায় মজায়,Your words are always funny.,Barisal
মোরে আম্মের মতামত জানাইয়েন,Let me know your opinion.,Barisal
তুই কি ঘুরবের যাবার,Are you planning to go on a trip?,Rangpur
তো এইহানে কোন কামের জন্য আইছো,"So, what work have you come here for?",Narail
এহনো ঘরডা ঝাড়ু দিস নাই,You still haven’t swept the house?,Khulna
আলু ভাতে দিয়ে মাখাও আর খাও,Mix the potato with rice and eat.,Khulna
তোর জন্য অপেক্ষা করিবার লাগছোং,Waiting for you.,Rangpur
তোকে দেখলে কলিজায় শান্তি আসে,Seeing you brings peace to my heart.,Narail
আল্লাহ যে তোর কপালোত ক্যানে এইল্লা দিল,why Allah have given this fate to you.,Rangpur
তুই কোনো সুমাই ঠিক কুরি কুথা বলিস না,You never say the right thing.,Khulna
তুই খুব দায়িত্ব নিয়ে কাজ করিস,You work very responsibly.,Rangpur
তোরে খুঁজতে গেছিলাম কই আছিলি,"I looked for you, where were you?",Khulna
তুমি কি এই বিষয়ে আরো জানো,Do you know more about this topic?,Narail
এহন খেলতে যাইবি নাকি পড়তে বইবি,Will you play now or read a book?,Khulna
এটা সম্ভব নোমায়,This is not possible.,Rangpur
ওয় সোকসময় দেরী করি আইসে,He always comes late.,Rangpur
এমনকরে তাদের পাঁচটি শহর শেষ হয়ে যায়,Thus their five cities came to an end.,Narail
গান উপভোগ করেছিলাম,I enjoyed the song.,Narail
এইডা কয়বার কইলাম,How many times have I told you this?,Khulna
তোর উৎসাহ সোগসমায় কাজত নাগে,Your encouragement is always helpful.,Rangpur
টপ করি আয়,Come quickly.,Rangpur
তুই কি জানিস আজ্গে কি দিন,Do you know what day it is today?,Khulna
মোরে আপনার মতামত জানায়েন,Tell me your opinion.,Narail
কি বিসাল,How big!,Khulna
আপনার উপদেশ মোর জন্য মূল্যবান,Your advice is valuable to me.,Narail
আমাদের গরু আইজকে ঘাস খাচেছ না,Our cows didn’t graze today.,Narail
তুমি এক ঘন্টা জেগে থাকো,You stay awake for an hour.,Narail
ইরতাজউদ্দিনের জন্মের পর আরহো পাঁচ ভাইবোনের পরের জন শাহেদ,"After the birth of Irtajuddin, Arho was the next of five siblings to be martyred.",Narail
কলিজা বাঁচি দেও,Choose the liver.,Rangpur
আওয়ার কালে কিছু লইয়া আইয়ো,Bring something when you arrive.,Barisal
তুমি কি প্রায়ই জিমে যাও,Do you often go to the gym?,Narail
তোমরা হগলডি এত্তো কতা হেকলা কোম্মেইদ্দা,Where did you all learn so much from?,Barisal
আমি সবসময় প্রকৃতই একজন ভাল শিশু ছিলাম বেশ দায়িত্ববানও,"I was always a really good kid, pretty responsible too.",Narail
হামরা একসাথে কাম করি,We work together.,Rangpur
দয়াকুরি ফোনডা দিদেন,Please give me the phone.,Khulna
তুমি অন্যর লইগ্গা সর্বদা সহায়ক,You are always helpful to others.,Barisal
তুমি কি কহোনো বিদেশে যাওয়ার কতা ভাবঝো,Have you ever planned to go abroad?,Barisal
এইহানে ভালোভাবে দাঁড়াও,Stand properly here.,Narail
গতরে বাতাস লেগে খুব আরাম লাগছে,The wind is blowing and it feels very comfortable.,Narail
এখন কাম শুরু করো,Start working now.,Narail
মোর গাড়িডা গতকাইল চুরি হইয়া গেছে,My car got stolen yesterday,Barisal
তুই এত সকাল সকাল উঠস ক্যারে,Why did you wake up so early?,Khulna
গরু বাইন্দা রাখছস কই,Where are you tying the cow?,Khulna
রুমা মোরে তার কাছে বসতে বলল,Ruma asked More to sit near her.,Narail
গরু ছিড়ি ধান খাইছে,The cow is eating rice.,Rangpur
মুই বার্তে তুই কোম্মে,"I'm at home, where are you?",Barisal
বৌদির হাতের পিঠা মজার,Sister-in-law’s rice cakes are tasty!,Rangpur
হে হগল সোমায় হাসিমোহে থাহে,He is always smiling.,Barisal
কি সোন্দর দৃশ্য,What a wonderful view!,Rangpur
যাবার আগে কইয়া যেয়ো,"Before you go, say something.",Narail
হেডা ভুলি যাও,Don’t forget this.,Khulna
কি দারুণ ব্যাপার,What a great thing!,Narail
তাড়াতাড়ি গোছায় নেও,Get ready quickly.,Khulna
জানালাটা খুলো,Open the window.,Narail
অফিসে কহোনো দেরি হইর্রো না,Never be late for office.,Barisal
আল্লাহ তোর ভাল করিবে,May Allah make things good for you.,Rangpur
মোরে আবার বাদ দিল কেন,Why did they drop me out again!,Narail
জানলা খোলো,Open the window.,Narail
তুমি কি হাঁতরাইতে পারো,can you swim,Barisal
এমতোন করি করিস না,Don’t do like this.,Rangpur
তুই কি কোনো নতুন প্রকল্পে কাজ করতি,Are you working on any new project?,Khulna
দেশের বর্তমান অবস্থা মেলা খারাপ,The current situation in the country is quite bad.,Narail
বাহ এই তো জীবন,Wow! This is life!,Narail
আজকে যেন আমার মনটা ভালো না,"Today, I don’t feel good.",Khulna
ওইতি মেলা হাসিখুশি মাইয়ে,She is very cheerful girl,Narail
মা ভাত নিয়ে আসছে,Mom is bringing rice.,Narail
কি অদ্ভুত মাইনশে,What a strange thing!,Narail
সবাক ডাকাও,Call everyone.,Rangpur
তোর হাতে সময় আছে নাকি,Do you even have time?,Khulna
এটি কোনা হামরা হামরায় তো,"Here we are, we are ourselves.",Rangpur
তুমি কি নুতান কিছু হেকছো,Are you learning something new?,Barisal
এই বইটা পড়ছিস,Have you read this book?,Rangpur
যা করতি কই তাই করো,Do whatever I say.,Khulna
ইস্যারে খাইলে পেটে আগুন লাগব,"If you eat this today, your stomach will burn!",Rangpur
তার জন্যে উপহাত কিনেক,Buy a gift for him.,Rangpur
মনের খুশিতে নাচতে ইচ্ছে কুর্তি,I want to dance with joy.,Khulna
আমি বাংলা বই পড়তি,I read Bangla books.,Khulna
মানষির দূন্যাম করিতে খুব ভাল নাগে,Does a person enjoy doing worldly things?,Rangpur
একটু শান্ত থাহুন,Calm down a little.,Narail
এবার দোইড় দেও,Now start running.,Narail
স্কুলির সয়য় মনে রেখো,Remember the school time.,Khulna
এই খাবারটা অনেক সেই মজাদার,This food is very delicious.,Narail
তোমার দরকার হলি এসিয়ানে,"If you need anything, come.",Khulna
সে সবদিন সকালে হাঁটে,He walks every morning.,Narail
মাচার উপরে বসে,Sit on the roof.,Khulna
আরে এতো তরতরি হরছো,Hey! You did it so fast!,Barisal
হ মোর একটা ভাই আছে,"Yes, I have a brother.",Rangpur
মোক অস্কার দেমেন,Give me an Oscar.,Rangpur
মুই বাংলা বই পড়ি,I read Bengali books.,Barisal
তুই মেলা হাত খোলা মানুষ,You are very generous.,Rangpur
মুই বই পড়বের খুব ভালোবাসোং,I love reading books.,Rangpur
কি হইছে ঝগড়া কির লইগ্গা,"What happened, why the fight?",Barisal
উফ কত্ত গরম,"Oh, it’s so hot!",Khulna
মাঠে কৃষেণেরা কাজ করছে,Farmers are working in the field.,Narail
আপনাকে দেখতে পেয়ে খুশি হলাম,I’m happy to see you.,Narail
তুই কি সাঁতার কাটতি পারিস,Do you know how to swim?,Khulna
তুই কুত্তী গেছিস,"Did you go, dog?",Rangpur
জালনাডা খোলো,Open the window.,Khulna
এইডা কই থেইক্কা আনছস,Where did you bring this from?,Khulna
বাহ তোর গলার স্বর কেরাম সুন্দর,"Wow, your voice is so beautiful!",Khulna
গরম পানি আনেক,Bring some warm water.,Rangpur
তুমি কিভাবে এত দ্রুত তাড়াতাড়ি পড়তে পারো,How can you read so fast?,Narail
কোনটি থাকি আইনেন,where did you come from,Rangpur
বাইরডা এক্কেরে গরম হইয়া গেছে,It’s very hot outside.,Khulna
মুলা আলু বাইগোন দিয়া নাবরা আন্দিছে,"They are making dishes with radish, potato, and eggplant.",Rangpur
মাঝে মাঝে আমার সাথে আপনি এট্টু কথা বলিয়েন,Sometimes talk to me a little.,Khulna
তোক না ডাংগেয়া ভাত খাইম না,I won't eat rice until I kill you.,Rangpur
লালনও গগনের গান গগনের সান্নিধ্য খুব পছন্দ করতেন,Lalon also loved Gagan's songs and his closeness.,Narail
আরে এত সুন্দর জায়গা আগে দেহিনি,Hey! I've never seen such a beautiful place before!,Narail
একনা সাহসী হয়া কাজ করেন,Be a little brave and act.,Rangpur
চাইয়া আছো ক্যা,Why are you with him?,Barisal
তুই কি চা খাবু,Would you like some tea?,Rangpur
এইটা কি সত্যি,Is this true?,Rangpur
তোমরা কি ভাবেন জানাইবেন,What is your opinion?,Rangpur
হামার জন্যে দোয়া করেন সবায় বাহে,Everyone prays for me.,Rangpur
আমনের লগে কথা কইয়া ভালা লাগসে,I like talking to you.,Barisal
পেইজডা উল্ডোও,Turn the page.,Khulna
এটে বইসেক আর অপেক্ষা করেক,Sit here and wait.,Rangpur
ওয় খুউব ভালো ছবি আঁকপের পায়,He draws very well.,Rangpur
কম্ফিউটার বন্দ অরো,Shut down the computer.,Narail
এই খাবারকোনটা ভাল না,This food is not good.,Rangpur
দরকার হলি আমার কাছে শুনিসক্যানে,"If needed, listen to me.",Khulna
তুই কি বাড়ী গেছিস,Have you gone home?,Rangpur
তুমি কি বাইরি বেড়াতি যাও,Do you go out for trips?,Narail
এই ছবিডা কে আঁকছে,Who drew this picture?,Khulna
মজা ফিটনেস জন্য নাচ,Dance for fun fitness,Narail
ওহ এতো মজা,Oh! So much fun!,Narail
তুই কই থাকিস,Where do you live?,Khulna
ভিডিওডা দেখ,Watch the video.,Khulna
নতুন ফোন কিনছিলাম,I was buying a new phone.,Narail
তুই কি কোনো পুরুষ্কার জিতছিশ,Have you won any awards?,Rangpur
বাসায় হগলডি কেমনতারা আছে,How is everyone at home?,Barisal
তুমি কি কোনও নতুন প্রকল্পে কাম করছো,Are you start working in new project,Narail
মোর প্রশ্নের উত্তর দেন,Answer my question.,Barisal
আজকে বার্ষিকী উদযাপন করো,Celebrate the anniversary today.,Narail
এইহানে বসো,Sit here.,Narail
জমি বেঁচে তোর লেখাপড়া করাইলাম,I sold land for your education.,Khulna
রাসেল কি ভাবতাস,"What do you think, Russell?",Narail
হেইডা আমার কাম না,That’s not my work!,Khulna
অয় খুব ভাল মানুষ,He is a good person.,Rangpur
এতো বড় কাম,Such a big deal!,Rangpur
তুমি কি মোর লগে আবা,will you come with me,Barisal
তুমি কি ব্যায়ান্নে কালে উঠে ব্যায়াম করো,Do you exercise early in the morning?,Narail
একাই একাই এই রহম করে লুকায় গিয়ে দাওয়াত খাইতেছেন,"Alone, quietly, they came and ate the invitation meal!",Narail
তুমি সবসময় হাছা কথা কং,I always tell the truth.,Rangpur
দেকা করিস তো বন্দোরোত,Try to meet at the port.,Rangpur
ওহ এতডা সোম্ভাব,Oh! So possible!,Barisal
ইশকুলের সময়সূচি দেক,Check the school schedule.,Rangpur
কলিজা বেইচ্চা দে,Choose the liver,Barisal
তুমি কি এমন কিছু শুনিছো যেইডে অদ্ভুত,Have you heard something strange?,Narail
তোর লগে বেশি কথা কইলেই দেহি সমস্যা,Talking too much with you always causes problems!,Khulna
আরে এতো সুন্দার জায়গা আগে দেহি নাই,Hey! Never seen such a beautiful place before!,Barisal
রুমি ম্যাডাম এটা পায়ছি,"I got this, Madam Roomi.",Narail
তোর মাইয়ারে স্কুলে দিছিলি,Did you send your daughter to school?,Khulna
তুমি দ্যাখতে মাশাল্লাহ,you are very smart,Barisal
না খেলাং মুই,"No, I didn’t play.",Rangpur
তোর লগে ঝগড়া কইরা লাভ নাই,There’s no use in arguing with you!,Khulna
অয় সব সময় ভালো চিন্তা করে,You always think positively.,Rangpur
আমনে এই কলমদা নেন,Take this pen.,Barisal
সে একজন ভালো মানুষ,He’s a good person.,Khulna
সেদিনকা কুকরের নাখান ন্যাদাই খায়া মোরও কমর খ্যান গেছলো ভাংগি তারপরে ডাকতোর আসিয়া পট্টি নাগাছলো,"That day, I got chased by a crazy dog and ended up breaking my back. Then the doctor came and put a bandage on it.",Rangpur
ওফ কতো গরম,Ugh! So hot!,Narail
আপনার স্বযত্ন রুটিন লাইক মন্তব্য করুন,Like and comment on your self-care routine.,Narail
