Sentence,English Translation, Labels
মুই কি আম্মের কিছু জানতে হারি,May I know something about you?,Barisal
তুই কি চা খাবু,Do you want to drink tea?,Rangpur
মোর বাবা একজন ডাক্তার,My father is a doctor.,Narail
অতিত আইছে,The guest is coming,Barisal
আজ খুব তাড়াতাড়িই বাসায় চলে আসলাম,I came home very early today.,Narail
কি সুন্দর সুন্ধী,How beautiful and fragrant!,Khulna
জন্য কিছু রিজার্ভ করতে পারি,Can we reserve something?,Khulna
একনা শান্ত থাকেন,Calm down.,Rangpur
এউগ্গা আগে হরো,Do it first.,Barisal
আজকে না কনসার্টটি ফাইন হবেন,Today’s concert will be great.,Khulna
আইজ মোর কোনো ইচ্ছা নাই,I'm not in the mood today.,Rangpur
ওয় মোর প্রিয় বন্ধ,He/She is my favorite friend.,Rangpur
তুমি কি বাইরে বেড়াতে যাও,Do you go out for trips?,Narail
কামডা সোঠিক বাইলে হরো,Do the job right.,Barisal
বাহ কেদন করি করলু,Wow! How did you do it!,Rangpur
তুমি সব কিছু সহজে হরতে পারো,You can do everything easily.,Barisal
মুই তোর লইগগ্যা কি আনমু,What should I bring for you?,Barisal
এম্মা করে তো ভেবে দেখি নি,"I didn't think about it,in this way",Narail
আমার জন্যি এক কাপ চা নি আসিয়ানে,Bring me a cup of tea.,Khulna
পোলাডা এক্কেরে দুষ্টামির চূড়ায়,That boy is at the peak of mischief!,Khulna
মোর এহন তোরে ভাললাগে,Now I like you.,Barisal
কি বিপদোত পরনু,What danger am I in?,Rangpur
আজি হামা তোমার বাড়ি যামো,Today we will go to your house.,Rangpur
আমি তোর লগে কাইলকা দেখা করুম,I’ll meet you tomorrow.,Khulna
ক্যানে যে এমতোন করিলু জীবনটা শেষ করিলু,Why did you do this? You’ve ruined your life.,Rangpur
কি করলি ভালো হয় এট্টু বুদ্ধি দেবেন,What would be good to do? Give me some advice.,Khulna
তোমরা হগলে আছো ক্যামন,how are you all,Barisal
মুই তোর সাথে বেরবার যাওয়ার চাং,I want to go for a walk with you.,Rangpur
আলু ভত্তা দিয়া মাখো আর খাও,Mash it with mashed potatoes and eat!,Rangpur
এইহানে আইসা বস তো ছোট্ট,"Sit here, little one.",Narail
তোমাকে ধন্যবাদ,Thank you.,Khulna
মুই দুই ঘন্টা পরে আসিম,I will come in two hours.,Rangpur
মনের খুশিত নাচপের মন চাবার লাগছে,I want to dance with joy!,Rangpur
তোর পরিশ্রম প্রসংশনীয়,Your hard work is commendable.,Rangpur
মাথাটা খুব ঝিমঝিম করছে,My head is very dizzy.,Narail
একটু অল্প করলেই হবে কি কোয়ান,"Just a little would be enough, okay?",Narail
মোরে লগে নেলে,take me with you,Barisal
মুইও পারি বলতে,I can also say it.,Narail
বইটা দেজাস কেন দিন,Why didn’t you give me the book that day,Khulna
তোর দাদা দাদীক মোর সালাম দিবু,Give my regards to your grandfather and grandmother.,Rangpur
সে খুব যত্নশীল বন্ধু,He’s a very caring friend.,Khulna
তুমি কি জানো আইজ কি দিন,Do you know what day it is today?,Narail
এটে অ্যাটে মোর জন্যে অপেকক্ষা কর,Wait for me here.,Rangpur
সুমাইয়া হ্যাগোর কাছে গ্যাছিলো,Sumaiya went to them,Narail
আহা কি মিষ্টি,"Ah, so sweet!",Khulna
মুই মেলা সমস্যায় আছি,do you play with my daughter.,Barisal
কুত্তি মরির গেছিস,You’ve gone to die like a dog,Rangpur
আমাগো এলাকায় খুব গরম,It’s very hot in our area!,Khulna
কর্ডাল গ্রাফ পারফেক্ট গ্রাফের একটি সাবসেট,Chordal graphs are a subset of perfect graphs.,Narail
এহন কাম শুরু হরো,Start working now.,Barisal
মোক জানাইলে খুব ভাল হয়,It would be great if you could tell me.,Rangpur
তোমার ফোনোত কয়টা এপ আছে,How many apps are on your phone?,Rangpur
আমরা আনন্দ খুঁজছিলাম,We were looking for joy.,Narail
তোমরা গুলার কমেন্ট পড়ি মুই খুব মজা পাইনু,I really enjoyed reading your comments.,Rangpur
উইয়াক মোর পছন্দ নাগে না,I don't like him.,Rangpur
আমাগো ভিটাডা খুব পুরান,Our homestead is very old.,Khulna
মোর এত্তি একনা খেয়াল কর,Pay some attention to me.,Rangpur
স্মার্টফোন ব্যবহার করা শিখেছিলাম,.I learned to use a smartphone.,Narail
হেই বুঝতে পারছেন না,"Hey, you don't understand.",Narail
এই কাপড়ডা ধুইয়া দে,Wash these clothes.,Khulna
মোর লইগ্গা কিছু ফল ফাকড়া লইয়া আাইয়েন,Bring some fruit for me?,Barisal
তোর বাহে আইলে কইস,Your father actually says,Barisal
মোর ফোনডা আইন্না দ্যাও,bring my phone,Barisal
তোমার কি কোন পেলান আছেন নাকি,Do you have any plans?,Rangpur
মুই রোংপুর যামু না,I will not go to Rangpur,Barisal
দক্ষিণে ম্যাঘ ম্যাগ হয়েছে অনেক,There has been a lot of rain in the south.,Narail
তুই কি করতি,What are you doing?,Khulna
তোমার আশাতে সবাই আনন্দ পায়,Everyone finds joy in your hopefulness.,Khulna
তর হাতে কুনো কাম নাই,Don’t you have any work?,Khulna
হেইডা নতুন বিয়া করসে,That person just got married.,Khulna
এখানে বসো এবং অপেক্ষা করো,Sit here and wait.,Narail
সে এহন আইব না,He won't come here.,Narail
এই কামডা হরা আ্যাকছের কঠিন,This is very difficult to do.,Barisal
শিক্ষাথীরা কসরত করছিলো,The students were practicing.,Narail
তুই ক্যামোন আছ,How are you?,Barisal
তোর বাহে এমোন এউক্কা সোমায়ে আইছে,Your father is coming at such a time,Barisal
আমি সবার ভাষা শুনে অবাক হয়ে গেছি,I am amazed listening to all languages.,Khulna
কম্পিউটার বন্ধ অফ করো,Turn off the computer.,Narail
সাব্বাশ আগায় যাও,"Well done, go ahead.",Narail
কোথায় আমরা বলতে চাই রংপুরের ভাষায়,We want to speak in Rangpur dialect.,Khulna
আমার কথা শুনস না ক্যানে,Why don’t you listen to me?,Rangpur
মোর সাতে আওচাও কাড়লে তোক ভালো নাগে,You like it when they teasing me,Rangpur
তুমি কি বাইরে ঘোরতে যাও,do you go out for a walk,Barisal
মোর কিছু কওয়ার নাই,I have nothing to say,Barisal
এইডা কোন কথা হইলো,What kind of talk is this?,Khulna
রফিক শফিক কাল কোয়ান্নে গেলির দুই মানিক রতন,Rafiq Shafiq Kal Kwanne Geli's two Manik Ratan,Narail
তুমি প্রেত্যেকটা দিনরে স্মরনীয় হইর্রা তোলো,You make every day memorable.,Barisal
শিক্ষাগত গবেষণা প্রমাণ ভিত্তিক শিক্ষণ অনুশীলনকে অবহিত করে,Educational research informs evidence-based teaching practice,Narail
তুমি কই গেছলি এত সময়,Where have you been all this time?,Rangpur
তোমার প্রিয় গান গাও,Sing your favorite song.,Narail
ওইডা ভুইল্লা যা,forget it,Barisal
তোর মতামত ক,What is your opinion?,Rangpur
আমার মনডা ছটফট করতে,My mind is restless.,Khulna
তুমার কথা সব সুমায় মজার,Your words are always fun.,Khulna
জমি বেচে তোক পড়া পড়ানু,I taught you to read while you were still alive.,Rangpur
তুমার পিলান আমারে কও,Tell me your plan.,Narail
কি থমথইম্মা পোরিবেশ,What a cool environment!,Barisal
আইজগো ক্লাসটা ক্যামন হইলো,How was the class today?,Barisal
রুমা আমার মাকে সব কইছিলো,Ruma told my mother everything.,Narail
তোমার কতাগুলা ব্যাতা দ্যায়,Your words hurt.,Barisal
তুমি অনেক ধৈর্যশীল,You’re very patient.,Khulna
তোমরা কি তমার বইটা একনা ধার দিবেন,Will you lend me your book?,Rangpur
তোমরা রংপুরের ভাষায় কথা কয়া শিহো নাই,You all don’t know how to speak in Rangpuri.,Narail
ওরে ওরে কি হুলো,"Oh no, what happened?",Khulna
আইজগো বার্ষিক উদযাপন হরবে,Celebrate the anniversary today.,Barisal
অয় খুব ভালো নাচে,He dances very well.,Rangpur
মোর কিছুই ভাল্লাগতেছে না,I don't feel like anything.,Barisal
বইডা এহানে রাহো,Put the book here.,Barisal
বনসাই চাষ একটি শান্তিপূর্ণ শখ,Bonsai cultivation is a peaceful hobby,Narail
দেওয়ানী কইল মুই আইজ যাবার পাবার নও,Dewani says I can't win today.,Rangpur
থাকি থাকি মনে হয় মোক আল্লাহ যদি পকির ন্যাখান পাকনা দেইল হয় মুই উড়িয়া তোমার বাড়িত গেনু হয়,Sometimes I wish Allah had given me wings like a bird; I would fly straight to your home,Rangpur
তোর চিন্তাভাবনা সোগসমায় ভাল,Your thoughts are always clear.,Rangpur
অবকাঠামোতে পরিবর্তন করছিলো,.was making changes to the infrastructure,Narail
তুই খুবে উৎসাহ দেয়ার মতোন মানুষ,You are a very inspiring person.,Rangpur
একটু সতর্ক হইতে কইয়েন,Tell me to be careful.,Barisal
আলুফা খাওয়া দিআয,Give Alufa food.,Barisal
ছ্যামড়ারা ফুটবল খেলছে,The boys are playing football.,Narail
তুমি কও কি কুরতিবে,"Tell me, what will we do?",Khulna
এইহানে আইয়ো তো একটু,Come here for a while,Barisal
কর্মচারীদের মান বেড়েছিল,.The quality of employees increased.,Narail
আজকের কনসার্টটি খুব ভালো হবে,Today's concert will be very good.,Narail
আমি বই পড়তে ভালোবাসি,I love reading books.,Narail
আপনার সাইজের একটু দরকার আছে,I need your size.,Khulna
পোলাডা খুব বেয়াদপ হইয়া গেছে,The boy has become very rude!,Khulna
বইটি পড়ে অনেক মজা পাইছিলাম,I had a lot of fun reading the book.,Narail
তোমাদের বাসা শহরের এহান থেকে কত ভিতরে হবে,How far from here will your house be in the city?,Narail
তুই কামডা ঠিকমতো শিখ,Learn the work properly.,Khulna
সবার সাতে ভাল ব্যাভার কর,Be nice to everyone.,Rangpur
তুমি কোয়ানে থাকো,Where do you live?,Narail
তোর লগে আর কতা কইতে চাই না,I don’t want to talk to you anymore!,Khulna
কেবা কেম্মা করে সম্ভব হলো ভাই এইটা,"Who/what made this possible, brother?",Narail
তুমি এউক্কা ভালো নেতা,You are a good leader.,Barisal
এখনা চা বানাও,Make some tea.,Rangpur
তুই খুব ভালো মানুষ,You are a very caring person.,Rangpur
দয়া কুরি এট্টু মনযোগ দেও,Please pay a little attention.,Khulna
তুই আইজ আইতত বাইরত যাবু,Are you going out tonight?,Rangpur
তোমাদের গন্তব্য যানি কোই,Where is your destination?,Narail
তুই কি কিছু শিখপের চাইশ,Do you want to learn something?,Rangpur
তোর পায়ে কি হইছে,What happened to your foot?,Khulna
সমস্যা সমাধান হচ্ছিল,.The problem was being solved.,Narail
মুই এলাও ইস্কলোত আছোং,I am also in school.,Rangpur
তুমি কি চা পছন্দ হরো,do you like tea,Barisal
তোমার উৎসাহ হগলসোমায় কামে লাগে,Your encouragement always helps.,Barisal
কি দুর্দান্ত ঘোরাঘুরি,What a great trip!,Barisal
তোমরা আবার গেছো,You all have gone again.,Narail
একাউন্ট হোল্ডার হইলাম,.I became an account holder.,Narail
হাই ঠিকঠাক আছে,"Hi, I am fine.",Khulna
মুখ না ধুয়া কিছু না খেয়া কি এইলা কথা কথা কোয়া যায় কন্ তো তোমায়,"Not washing the face, eating nothing, how can someone talk like this to you?",Rangpur
মুই জানোং না,I don't know.,Rangpur
দয়া করি মোক এখনা সমায় দেন,"Give me a moment, please.",Rangpur
স্মাটটেলিফোন ব্যবহার করিতাম,I used a smartphone.,Narail
মোর মা নাস্তা নিয়ে মোর অপেক্ষায় থাকতেন,My mother would be waiting for me with breakfast.,Narail
মুই কোনো ডায়ালগ দিবার পাবার নও,I can't give any dialogue.,Rangpur
সে ইংরেজি পড়েছিলো,He studied English.,Narail
এতো দেরি হরছো ক্যা,Why is it so late?,Barisal
আইলের ধারত বসি গপ্প করবের চাইস,"When you came, you wanted to sit and chat.",Rangpur
মুই রোংপুরের কতা হোনলে ঠিক থাকতে হারি না,I can't get enough of Rangpur,Barisal
মুই প্রতিদিন ব্যায়াম করি,I exercise every day.,Narail
তুমি কি কহনও বিদেশে যায়ার পরিকল্পনা করিছো,Have you ever planned to go abroad?,Narail
মোর একটু সমেস্যা হইছে,I have a little problem.,Barisal
কি ব্যাপার কোয়ানে ছিলে রাতে,"What's the matter, where were you last night?",Narail
তুই কি চা খাবি,Do you want some tea?,Khulna
কোম্মে তুই,where are you,Barisal
বৃষ্টি নামলে কি করমু,What will we do if it rains?,Rangpur
তোমার জন্য আমি অনেক সম্মান পাই,Because of you I get a lot of respect.,Khulna
তোমরা আইছো একটু বহো,"You all come, sit for a bit.",Narail
দয়া করি শান্ত হ,Please calm down.,Rangpur
তুই আমারে কি কলির,What are you telling me?,Narail
কি সুন্দার হাসি,What a beautiful smile!,Barisal
একনা শান্ত হ,Calm down.,Rangpur
তুমি কি মোরে সাহায্য করবে,Will you help me?,Narail
এহন তুমি কোম্মে,where are you now,Barisal
হায় হায় কেমনে হলো এইডা,Oh my! How did this happen!,Narail
এট্টু অপেক্ষা অরো তুমি,Wait a little.,Narail
আমি কাইলকে তোমাদের বাসায় আসতাছি,"tomorrow,I'm cominmg to your house.",Narail
ঈদের সময় গাঁয়ে উৎসব হয়,There is a festival in the village during Eid.,Narail
তুমি আ্যাকছের উদার মোনের,You are very generous.,Barisal
সোমায় হইর্রা খাইয়া লইস,Eat in time,Barisal
আমি পতিদিন ব্যায়াম করি,I exercise every day.,Khulna
ক্যামন লাগলে,how did it feel,Barisal
হাল চাষার পরিশ্রম ফসলেই সমাধান,The farmer’s hard work shows in the harvest!,Rangpur
তুমি আ্যাকছের অনুপ্রেরণাদায়ক মানু,You are a very inspiring person.,Barisal
তুমি হাইঙ্গো সোমায় উৎসাহী,You are always enthusiastic.,Barisal
মুই রাইতোত তাড়াতাড়ি ঘুমাং,I go to bed early at night.,Rangpur
একটু সোমায় হইলে ভালো হয়,A little time will be good.,Barisal
আইজগো তোমার পরিকল্পনা কি,What are your plans today?,Barisal
আমায় মুখ সবসময় ভাল বুদ্ধি দেয়,He always inspires me.,Rangpur
একটু সাহস লইয়্যা কামডা হরেন,Be brave.,Barisal
তুই ভাল কতা কইস,You speak well.,Rangpur
বাষ্যালি দিন একেনাও ভাল নাগেনা,I don’t like rainy days anymore.,Rangpur
কোয়ান্টাম তড়িৎগতিবিজ্ঞানের উন্নয়নে হেই বিশেষ ভূমিকা রেখেছে,He played a special role in the development of quantum electrodynamics.,Narail
হামরা একসাথে খাবার যাই,We are going to eat together.,Rangpur
বাহ তুমি সুন্দর করেছো,"Wow, you did beautifully.",Khulna
আয় বাবু হাছকিরিম খাই,"Come here, baby, let’s eat icecream",Rangpur
অফিসে কিন্তু দেরি করিস না,Never be late for the office.,Rangpur
এই রাস্তাডা কই যায়,Where does this road go?,Khulna
সম্পদের চেয়ে অভিজ্ঞতায় বিনিয়োগ করুন,Invest in experiences rather than assets.,Narail
মুই এই সিদ্ধান্তোত রাজি নোমাং,I do not agree with this decision.,Rangpur
কোনদিন আইছেন,Are you ever coming?,Barisal
মোদের সঙ্গে চলো,Come with us,Narail
সুমনমোক খাবার দিছিলো,Suman gave me food.,Rangpur
নাসিম তোর লগে যানো কাকে দেখেছিলাম,i had seen someone with nasim,Narail
সাঁতার সারা গতরে টোন দেয়,Swimming tones the entire body,Narail
বিয়াও তো খাবারে নাগিবে,Even a wedding requires food.,Rangpur
তুমি জানলে জানাবা,Tell me if you know.,Barisal
তুমি কি নতুন রান্না শিখতি ইচ্ছুক,Are you interested in learning new recipes?,Narail
বও হগলডি,everyone sit down,Barisal
হে মেলা বেলা কইররা ঘুমায়,He sleeps at odd times,Barisal
ওরে কি মজা,"Oh, how fun!",Khulna
একনা একলায় থাকার অনুমতি দেবেন,Will you allow me to be alone for a while?,Rangpur
তোমার পছন্দের গায়ক কেটা,Who is your favorite singer?,Rangpur
ইস্যারে কিনলাম কাইলক বাজার থেকে,I bought this today from the market.,Rangpur
তুই জানলেই কইশ,Tell me if you know.,Rangpur
এরপর কিছুটা বাইড়েস,Then a little bit of byrds.,Narail
মোগো এহানে আইয়েন,Come here to us,Barisal
মুই এলা জাবার পাবাননাও,I can't go now.,Rangpur
তুমি কি কিছু শিখতে চাও,Do you want to learn something?,Narail
দরকার হলি আামরে জিগ্গাসা কইরো,Ask me if you need help.,Narail
তোর পরিশ্রমের ফলাফল অনেক ভাল,The results of your hard work are amazing.,Rangpur
তুই বাজারে যাইস নাকি,Are you going to the market?,Khulna
পারমু না মুই,i can't,Barisal
মোর হাতে ব্যথা করতেয়াছে,My hands hurt.,Barisal
ক্যামেরা কিনতে চাইলাম,I wanted to buy a camera.,Narail
তোর আব্বারে ডাক দে,Call your father.,Khulna
কি চমেতকার দৃশ্য,What a beautiful view!,Rangpur
মুই এ্যাল একন কি করং,What should I do now?,Rangpur
মুই খুব মন খারাপ করিম,I will be very upset.,Rangpur
আমায়গে তো রাখতে মন চায়,I want to keep you here.,Khulna
মোক ডিগিত ঝাপাইলপারির মনায়ছে,I feel like jumping into the pond.,Rangpur
এহনো কামডা শেষ হয় নাই,You still haven’t finished the work?,Khulna
আলু ভর্তা দিয়া ভাত খাইম,We will eat rice with mashed potatoes.,Rangpur
ঠান্ডা পানি খাইস না ঠান্ডা লাগবে,Have you drunk cold water? It will make you feel cold.,Narail
তত্তোরি আইয়ো,come quickly,Barisal
গরুইল দৌড়াইছে দেয়ালে,The cow is running along the wall!,Rangpur
মোর আর কাম করবের ইচ্ছা করোছে না,I don't feel like working anymore today.,Rangpur
হেতিরা বই পড়তাছিলো,They were reading books.,Narail
তুমি দুফুরে কিদা ভাত খাইছেলা,What did you have for lunch?,Barisal
দেরি হয়া গেইল,It has gotten late.,Rangpur
তুই কি এই ব্যাপারে আরো জানিশ,Do you know more about this?,Rangpur
আহা কি যে মিডা,Aha! How sweet!,Barisal
অমরা আর কোন দিনও ফিরবার নয়,He will never return.,Rangpur
মোক কি একনা জাগা দেখাইবেন,Can you show me a little place?,Rangpur
তুমি ভালো কতা কও,You speak well.,Barisal
তুই আমার লগে ঝগড়া করিস ক্যারে,Why do you fight with me?,Khulna
তুই কোনোদিন ঠিক করি কতা কইস না,You never speak properly.,Rangpur
ওয় কোনোদিন কতা দিয়া কতা থোয় না,He never keeps his word.,Rangpur
আইজগো মোর মোনডা কির লইগ্যা যেনো ভালো নাই,I don't know why I'm not feeling well today.,Barisal
তুই এহন এইহানে ঐহানে ঘুরে বেড়াইতেছোস,Now you are roaming here and there.,Narail
রিমোট ব্যবহার করেছিলাম,I used the remote.,Narail
একটু রও দিহি,calm down,Barisal
আমার জন্যি এট্টু দয়া দেখান,Show me some kindness.,Khulna
মেলায় সার্কাস আয়োজন হয়ছিল,A circus was organized at the fair.,Narail
তোর জন্য একনা কিছু আনচ্ছং,I brought something for you.,Rangpur
